id,name,price,description,image,category_id,brand_id,brand_name,tiki_product_id
1,Máy đọc sách All New Kindle Paperwhite 5 (11th Gen) - Hàng nhập khẩu,3680000,Amazon vừa chính thức ra mắt thế hệ tiếp theo của dòng máy đọc sách Kindle Paperwhite.Kindle Paperwhite 5 (hay Kindle Paperwhite 11th Gen) là phiên bản thay thế cho chiếc Kindle Paperwhite 4 đã ra ...,https://salt.tikicdn.com/cache/280x280/ts/product/14/2f/c6/a161edd03cf817a13d4c3255d1467f0a.jpg,1,147856,Kindle,125182567
2,"Điện thoại AI Samsung Galaxy S24 Ultra, Camera 200MP Zoom 100x, S Pen - Hàng Chính Hãng",28020000,Điện thoại Samsung Galaxy S24 Ultra 5G- Hàng chính hãngMàn hình với độ sáng thích ứng lớn nhất lên đến 2600 nitMặt kính Corning Gorilla Armor giúp giảm phản xạ và cải thiện độ sắc nét của hình ảnh...,https://salt.tikicdn.com/cache/280x280/ts/product/c1/77/a8/81aeda13c278a2f63f5cd870fd5bbdf0.jpg,1,18802,Samsung,273947792
3,Máy đọc sách Kindle Scribe - Hàng chính hãng,12290000,"Đọc và viết tự nhiên như khi làm trên giấyVới màn hình E-ink 10,2 inch, độ phân giải 300 ppi chống lóa. Kindle Scribe hoàn hảo để đọc và viết, ngay cả dưới ánh sáng mặt trời. Màn hình lớn cung cấp ch...",https://salt.tikicdn.com/cache/280x280/ts/product/71/e5/0c/7b51868c1d7a251b6e66cde178f04d85.jpg,1,147856,Kindle,217640502
4,Máy đọc sách All New Kindle Paperwhite 5 (11th Gen) - Hàng chính hãng,3976200,  Amazon vừa chính thức ra mắt thế hệ tiếp theo của dòng máy đọc sách Kindle Paperwhite.Kindle Paperwhite 5 (hay Kindle Paperwhite 11th Gen) là phiên bản thay thế cho chiếc Kindle Paperwhite ...,https://salt.tikicdn.com/cache/280x280/ts/product/3a/6a/88/dab7a029b67ae97fae23ffa292ffa74e.jpg,1,147856,Kindle,252586291
5,Apple iPhone 11,9990000,"Nội dung về tính năngQuay video 4K, chụp ảnh chân dung tuyệt đẹp và chụp phong cảnh rộng với hệ thống camera kép hoàn toàn mới. Chụp ảnh tối ưu trong điều kiện ánh sáng yếu với chế độ Ban Đêm. Xem ản...",https://salt.tikicdn.com/cache/280x280/ts/product/aa/24/e0/d73c22287081d807af0de9cb48a79f3c.jpg,1,17827,Apple,184036446
6,Apple iPhone 13,13490000,iPhone 13. Hệ thống camera kép tiên tiến nhất từng có trên iPhone. Chip A15 Bionic thần tốc. Bước nhảy vọt về thời lượng pin. Thiết kế bền bỉ. Mạng 5G siêu nhanh.1 Cùng với màn hình Super Retina XDR s...,https://salt.tikicdn.com/cache/280x280/ts/product/b7/ba/88/66059a54a3a139d45841d412379b1fe4.jpg,1,17827,Apple,184059211
7,"Apple iPad 10.2-inch (9th Gen) Wi-Fi, 2021",6990000,"Nội dung quảng cáoMạnh mẽ. Dễ sử dụng. Linh hoạt. iPad có màn hình Retina 10.2 inch tuyệt đẹp, chip A13 Bionic mạnh mẽ, camera trước Ultra Wide có tính năng Trung Tâm Màn Hình, tương thích với Apple ...",https://salt.tikicdn.com/cache/280x280/ts/product/54/ff/25/bfdf0febe11a28eaa7cd3fa735a82c49.png,1,17827,Apple,183330021
8,Điện thoại Xiaomi Redmi 9A (2GB/32GB) - Hàng chính hãng,1690000,"Màn hình giọt nước, viền máy mỏngĐiện thoại Xiaomi Redmi 9A sở hữu một màn hình tràn viền kích thước cực lớn 6.53 inch với thiết kế theo kiểu giọt nước quen thuộc, đi theo xu hướng chung của những mẫ...",https://salt.tikicdn.com/cache/280x280/ts/product/22/34/6c/f2f6ca4edc76d9ba9fbb03ac976c06ae.png,1,25422,Xiaomi,57809866
9,Combo Máy đọc sách All New Kindle Paperwhite 5 (11th Gen) - 16Gb và Bao da - Hàng nhập khẩu,4090000,Amazon vừa chính thức ra mắt thế hệ tiếp theo của dòng máy đọc sách Kindle Paperwhite.Kindle Paperwhite 5 (hay Kindle Paperwhite 11th Gen) là phiên bản thay thế cho chiếc Kindle Paperwhite 4 đã ra ...,https://salt.tikicdn.com/cache/280x280/ts/product/51/8f/6b/1d558fab3d6a12743156ccbdbe0f4f8f.jpg,1,147856,Kindle,217645692
10,Máy tính bảng Kindle Fire HD10 2023 13th - 32Gb - Hàng chính hãng,3290000,Máy tính bảng Kindle Fire 13th – Cho Từng Trải Nghiệm Hoàn HảoMáy tính bảng Kindle Fire HD 13th là bản nâng cấp nhẹ của phiên bản năm Kindle Fire 2021 (thế hệ 11) với khá nhiều điểm nổi trội.Thiết k...,https://salt.tikicdn.com/cache/280x280/ts/product/33/28/66/febee83933032405001356017833d52c.jpg,1,147856,Kindle,273559020
11,Máy đọc sách All New Kindle Oasis 3 - Hàng nhập khẩu,6190000,"Độ phân giải màn hình cực caoMáy đọc sách All New Kindle Oasis 3 với màn hình 7 inch và mật độ ảnh 300 ppi, văn bản hiển thị trên thiết bị với chất lượng sắc nét, đọc như giấy thật ngay cả trong ánh ...",https://salt.tikicdn.com/cache/280x280/ts/product/30/ca/07/0807773d470e426aa2c80b8611245421.jpg,1,147856,Kindle,173387789
12,Combo Máy đọc sách All New Kindle Paperwhite 5 (11th Gen) và Bao da - Hàng nhập khẩu,3690000,Amazon vừa chính thức ra mắt thế hệ tiếp theo của dòng máy đọc sách Kindle Paperwhite.Kindle Paperwhite 5 (hay Kindle Paperwhite 11th Gen) là phiên bản thay thế cho chiếc Kindle Paperwhite 4 đã ra ...,https://salt.tikicdn.com/cache/280x280/ts/product/5a/a9/fd/6fe6aa80db8a8c896ea852619df906f2.jpg,1,147856,Kindle,217706932
13,Điện Thoại Nokia C30 (2GB/32GB) - Hàng Chính Hãng,1640000,"Nokia C30 là dòng smartphone giá rẻ được Nokia chăm chút và đầu tư kỹ lưỡng với những nâng cấp đáng kể cả về ngoại hình lẫn hiệu năng, hứa hẹn mang đến cho người dùng những trải nghiệm tuyệt vời hơn b...",https://salt.tikicdn.com/cache/280x280/ts/product/5c/57/85/312c7a38df0312e7525a18f61c5a0fbc.jpg,1,19673,Nokia,120295859
14,Apple iPhone 12,12750000,"Điện Thoại iPhone 12iPhone 12 đẩy nhanh mọi tác vụ với mạng 5G siêu nhanh.1 A14 Bionic, chip nhanh nhất trên điện thoại thông minh. Hệ thống camera kép mới. Với màn hình Super Retina XDR tuyệt đẹp, n...",https://salt.tikicdn.com/cache/280x280/ts/product/8b/1f/d8/fe77cababd0fe575333a17ef5432dabb.jpg,1,17827,Apple,123345348
15,"Apple iPad mini (6th Gen) Wi-Fi, 2021",11490000,iPad mini. Thiết kế màn hình toàn phần với màn hình Liquid Retina 8.3 inch.1 Chip A15 Bionic mạnh mẽ với Neural Engine. Camera trước Ultra Wide 12MP với tính năng Trung Tâm Màn Hình. Cổng kết nối USB-...,https://salt.tikicdn.com/cache/280x280/ts/product/49/75/99/2219ae33da6fb87ec3231dae0e752b3a.jpg,1,17827,Apple,184248127
16,Điện thoại bàn Panasonic  KX-TS500MX-hàng chính hãng,300000,"Treo tường hoặc để bànĐiều chỉnh âm lượng, chuôngQuay số nhanhĐèn tín hiệuSản xuất tại MalaysiaBảo hành 1 năm chính hãng Panasonic Giá bán đã thuế 10% VAT...",https://salt.tikicdn.com/cache/280x280/ts/product/be/09/b7/55917b01ae380cdb1e6acce0ae683370.jpg,1,18804,Panasonic,163914808
17,Máy đọc sách Kindle Oasis 3 (2019) - Amazon - Hàng nhập khẩu,6043100,"Độ phân giải màn hình cực caoMáy đọc sách Kindle Oasis 32G với màn hình 7 inch và mật độ ảnh 300 ppi, văn bản hiển thị trên thiết bị với chất lượng sắc nét, đọc như giấy thật ngay cả trong ánh sáng m...",https://salt.tikicdn.com/cache/280x280/ts/product/2f/d2/4b/734d799a9b582017c71db858af78f27f.jpg,1,147856,Kindle,43924153
18,"Combo Máy đọc sách All New Kindle Paperwhite 5 (11th Gen) và Bao da FOR KIDS (Bản KIDS, Không Quảng Cáo) - Hàng chính hãng",3790000,Amazon vừa chính thức ra mắt thế hệ tiếp theo của dòng máy đọc sách Kindle Paperwhite.Kindle Paperwhite 5 (hay Kindle Paperwhite 11th Gen) là phiên bản thay thế cho chiếc Kindle Paperwhite 4 đã ra ...,https://salt.tikicdn.com/cache/280x280/ts/product/4d/65/eb/8cc241b558538e304ff89118215eb0f7.jpeg,1,147856,Kindle,271362153
19,Điện Thoại Vivo V25e 2022 (8GB/128GB) - Hàng Chính Hãng,8490000,"Thiết kế đẳng cấp với mặt lưng thay đổi màu sắcV25 Series không chỉ sở hữu ngôn ngữ thiết kế hiện đại với cạnh viền vát phẳng đang là hot trend ở thời điểm hiện tại, thân máy siêu mỏng chỉ 7.79 mm và...",https://salt.tikicdn.com/cache/280x280/ts/product/9a/87/48/b967172efd2e707fbb5a707cb9331e30.png,1,52232,Vivo,198111545
20,Điện Thoại Bàn Panasonic KX-TSC11 - Hàng Chính Hãng,600000,"Điện thoại chính hãng Panasonic KX-TSC11– Màn hình hiển thị số gọi đến, gọi đi.– Bộ nhớ 50 số điện thoại.– Nhớ 50 số gọi đến 10 số gọi đi.– Khoá đường dài, di động bằng mã.– Có các mức điều chỉnh...",https://salt.tikicdn.com/cache/280x280/ts/product/69/87/36/29423f1956f9bf6d3299a8dbb34dd704.jpg,1,18804,Panasonic,204237269
21,Điện thoại bàn Panasonic KX-TS880 hàng chính hãng,1050000,"- Màn hình LCD hiển thị số gọi đến.- Danh bạ 50 số, nhớ 20 số gọi đi.- 20 số gọi bằng 1 phím bấm.- 10 phím quay số nhanh.- Có Speaker phone 2 chiều.- Chức năng tự động gọi lại.- Chế độ câm tiếng...",https://salt.tikicdn.com/cache/280x280/ts/product/f8/c7/f6/e0e8a6f7589e1e80f0c88840c8c7408c.jpg,1,18804,Panasonic,181977398
22,Máy đọc sách Kobo Libra 2 - hàng nhập khẩu,5250000,"Bản nâng cấp cập nhật của Kobo Libra H20 mới ra mắt, mở bán lần đầu trên thế giới ngày 20/10/2021 . Cùng với Kobo Sage,  phiên bản được mong chờ nhất cuối năm 2021.Chiếc máy đọc sách nào hoàn hảo cho...",https://salt.tikicdn.com/cache/280x280/ts/product/f5/e5/82/331a50d0d1e2809ef32a38eb201197ad.jpg,1,183625,Kobo,139632023
23,Điện Thoại Xiaomi Redmi 10 4GB/128GB - Hàng Chính Hãng,2889000,"Điện Thoại Xiaomi Redmi 10 4GB/128GB - Hàng Chính HãngBộ sản phẩm bao gồm: Pin, sạc, cáp USB kiểu C, ốp lưng, hướng dẫn, cây tháo sim.Thiết kế- Màn hình đục lỗ có kích thước 6.5 inch sẽ đem đến tr...",https://salt.tikicdn.com/cache/280x280/ts/product/bf/ff/d8/b361ab48631a1757ec82c109f8ee835f.jpg,1,25422,Xiaomi,121744434
24,Điện Thoại Bàn Cố Định Không Dây Lắp Sim,650000,"Điện thoại bànĐiện thoại cố định không dâyDòng cố định không dây lắp SIMLắp SIM cố định hoặc SIM di động đều đượcLắp tất cả các loại SIM của tất cả các thị trường hiện có Viettel, Vina, Mobi, Viet...",https://salt.tikicdn.com/cache/280x280/ts/product/b7/4b/30/15740537205344ced549c2ebba42fddc.jpg,1,19788,Huawei,31261844
25,Điện thoại bàn có dây nhỏ gọn màu trắng,250000,điện thoại bàncó dây kiểu dáng nhỏ gọnsố to rõ dễ sử dụng  ...,https://salt.tikicdn.com/cache/280x280/ts/product/8a/fe/92/8798ddc7a8b8fb08aa4e5e3146819faf.jpg,1,111461,OEM,73842403
26,Điện thoại Masstel izi 26 4G - Gọi HD Call - Hàng chính hãng,499000,"Thắng Thao Mobile cam kếtMáy chuẩn 4G không lo cắt sóng 2GHàng chính hãng mới 100%Bảo hành 12 thángTÍNH NĂNG NỔI BẬTMàu Sắc: Black, Blue Dung Lượng Pin: 1800mAh Hỗ Trợ Khác: đài FM không d...",https://salt.tikicdn.com/cache/280x280/ts/product/f5/0b/df/eb4084ef538dba69cc3bbeab80461504.jpg,1,112638,Masstel,197654695
27,Điện thoại Masstel Lux 20 4G - Sang trọng - Gọi HD Call - Hàng chính hãng,579000,"Thắng Thao Mobile cam kếtMáy chuẩn 4G không lo cắt sóng 2GHàng chính hãng mới 100%Bảo hành 12 tháng TÍNH NĂNG NỔI BẬTMàu Sắc : Blue, Gold, Silver Dung Lượng Pin: 1800mAh Màn hình: 2.4′ QV...",https://salt.tikicdn.com/cache/280x280/ts/product/b1/34/34/cbf32482a6649db2e46cb74f53d621ce.jpg,1,192229,Massel,197652030
28,Điện thoại Xiaomi Redmi 10A (2GB/32GB) - Hàng chính hãng,1949000," Màn hình: IPS LCD 6.53"", HD+ (720 x 1600 Pixels) Hệ điều hành: Android 11 Camera sau: 13 MP + 2 MP Camera trước: 5 MP Chipset: MediaTek MT6762G Helio G25 RAM: 2 GB Bộ nhớ trong: 32 GB Cổng kết...",https://salt.tikicdn.com/cache/280x280/ts/product/e1/5b/5f/850b5bc473bf058c23bc18fc48c6c8ae.jpg,1,25422,Xiaomi,189466001
29,Điện thoại Masstel Lux 10 4G - Sang trọng - Gọi HD Call - Hàng chính hãng,549000,"Thắng Thao Mobile cam kếtMáy chuẩn 4G không lo cắt sóng 2GHàng chính hãng mới 100%Bảo hành 12 tháng THÔNG TIN CHI TIẾT :  Màu Sắc : Blue, Green, Silver Dung Lượng Pin : 1400 mAh Màn hình...",https://salt.tikicdn.com/cache/280x280/ts/product/bb/d4/c2/da17e0ac867fe320f70c634eab63ea43.jpg,1,112638,Masstel,197960169
30,Điện Thoại Cố Định Panasonic KX-TS580MX - Hàng chính hãng,940000,"Điện thoại bàn Panasonic KX-TS580K - Mầu đen Trắng·Màn hình LCD hiển thị rõ ràng và dễ đọc.·Hiển thị số điện thoại gọi đến, gọi đi.·Nhớ 50 số điện thoại gọi đến, 20 số gọi đi.·Danh bạ nhớ 50 tên v...",https://salt.tikicdn.com/cache/280x280/ts/product/af/54/58/7d7533b202de2b84d6595027e2d62f81.jpg,1,18804,Panasonic,11415485
31,Điện thoại Nokia C30 2GB/32GB - Hàng chính hãng,1550000,"Giải trí hoàn hảo với màn hình siêu rộng 6.82” chuẩn HD+ mang đến trải nghiệm giải trí sắc nét và thưởng thức nội dung trọn vẹn.Pin bền bỉ dài ngày, Pin trâu bền bỉ 6000 mAh cho thời gian làm việc và ...",https://salt.tikicdn.com/cache/280x280/ts/product/ae/77/39/dc4d08a8b156a0c2f797f95a1860bc8c.jpg,1,19673,Nokia,125590981
32,Máy đọc sách Kobo Clara 2e - Hàng Chính Hãng,2990000,GIỚI THIỆUKobo Clara là dòng máy đọc sách 6inch nhỏ gọn với các tính năng mà chỉ xuất hiện ở các dòng máy đọc sách cao cấp. Tự tin là máy đọc sách không có đối thủ trong phân khúc..Sản phù hợp đáp ứ...,https://salt.tikicdn.com/cache/280x280/ts/product/df/2e/70/0b6bbfe30368b689dae79b3aab01cf20.jpg,1,183625,Kobo,270794184
33,Điện thoại bàn Ktel 645 hàng chính hãng,398000,"• Màn hình lớn gấp đôi-số to, rõ hiện lịch, đồng hồ, số gọi tới, gọi đi (không pin).• Bộ nhớ 30 cuộc gọi tới, 10 cuộc gọi đi (mã vùng, số điện thoại, thời gian).• Xóa, gọi lại số gọi đi, gọi tới. Nhấn...",https://salt.tikicdn.com/cache/280x280/ts/product/ee/92/92/def752a331e3d6c937308018f66aef33.jpg,1,5178283,KTEL,170165701
34,"Máy tính bảng Fire HD10 2021 - 11th - (All New Fire HD10 - 2021) - Ram 3/4GB, bộ nhớ 32GB, màn hình 1080 FullHD",3700000,ALL NEW Fire HD10 2021 (11th) là dòng sản phẩm đánh vào phân khúc giá rẻ của máy tính bảng. Mục đích ban đầu của nhà sản xuất là bù đắp cho sự thiếu hụt của máy đọc sách công nghệ Eink ở tính năng đọc...,https://salt.tikicdn.com/cache/280x280/ts/product/5a/e3/eb/69dfb9e816fa2467b0ebddde6b837dad.jpg,1,111461,OEM,150724369
35,Máy tính bảng Kindle File HD 8 (10th generation - 2020) Hàng nhập khẩu,2250000,"Đánh giá máy tính bảng giá rẻ Amazon Fire HD 8 2020: Đã tốt nay còn tốt hơn!Amazon Fire HD 8 2020 với bộ xử lý nhanh hơn, dung lượng RAM mở rộng cùng cổng sạc USB-C sẽ là chiếc máy tính bảng giá rẻ cự...",https://salt.tikicdn.com/cache/280x280/ts/product/ae/a0/5a/4c2fce9c5bac5e8e8ff55dd748464ef0.jpg,1,147856,Kindle,173557858
36,Điện thoại Xiaomi Redmi 9A (2GB/32GB) - Hàng chính hãng,1790000,"Cấu hình Điện thoại Xiaomi Redmi 9A Màn hình: IPS LCD6.53""HD+Hệ điều hành: Android 10Camera sau: 13 MPCamera trước: 5 MPChip: MediaTek Helio G25RAM: 2 GBBộ nhớ trong: 32 GBSIM: 2 Nano SIMHỗ t...",https://salt.tikicdn.com/cache/280x280/ts/product/d5/07/9f/4ca7dfbb9c37e3d3f3ecc1c66b83817d.jpg,1,25422,Xiaomi,172329599
37,Điện thoại Nokia 105 4G - Hàng chính hãng,675000,"​Nokia 105 4G - Chiếc điện thoại phổ thông nổi bật với thiết kế sang trọng, khả năng nghe gọi bền bỉ trong thời gian dài, hỗ trợ công nghệ 4G cùng nhiều tiện ích giải trí hấp dẫn khác đến từ nhà Nokia...",https://salt.tikicdn.com/cache/280x280/ts/product/2c/b3/31/c2460f6ae2e24aac3b17a9872c8243b7.jpg,1,19673,Nokia,168526284
38,Điện thoại Itel it9010 4G - Hàng chính hãng,399000,"Cấu hình Điện thoại Itel it9010 4G Màn hình: LCD1.77""256.000 màuSIM: 2 Micro SIMHỗ trợ 4GDanh bạ: 2000 sốThẻ nhớ: MicroSD, hỗ trợ tối đa 64 GBCamera sau: 0.08 MPRadio FM: CóJack cắm tai nghe: ...",https://salt.tikicdn.com/cache/280x280/ts/product/98/de/7a/ab7fd64852ee97c026915904d1a3da7c.jpg,1,111684,Itel,184578632
39,"Điện thoại cố định không dây cho người già, màn hình hiển thị đầu số - Hàng chính hãng",490000,"Điện thoại bànĐiện thoại cố định không dâyDòng cố định không dây lắp SIMLắp SIM cố định hoặc SIM di động đều đượcLắp tất cả các loại SIM của tất cả các thị trường hiện có Viettel, Vina, Mobi, Viet...",https://salt.tikicdn.com/cache/280x280/ts/product/76/d8/38/696f093021940f0ffe332f2fb05e0971.jpg,1,19788,Huawei,42333095
40, Máy tính bảng Oppo Pad Air (4GB/64GB) - Hàng Chính Hãng,5490000,Thiết kế hiện đạiMáy tính bảng OPPO Pad Air sử dụng kiểu thiết kế vuông vức trông rất hợp xu hướng. Mặt lưng thiết bị có một ống kính camera đơn và có thiết kế vệt màu chạy dọc mặt lưng độc đáo.OPPO...,https://salt.tikicdn.com/cache/280x280/ts/product/3d/0c/dd/ed807863cff5dd3a112b0d000ba6c3ff.jpg,1,25643,OPPO,195317118
41,"Ulefone Armor X 5 ( chống nước,chống va đập,pin 5.000mAh ) hàng chính hãng",3990000,"Được chứng nhận đạt mức IP68 / IP69K cao nhất, nó có thể xử lý 30 phút ngâm trong 1,5 mét nước hoặc 24 giờ nộp trong 1 mét bê tông. Trong khi đó, nó cũng có thể chịu được những giọt lớn lên tới 1,2 ...",https://salt.tikicdn.com/cache/280x280/ts/product/db/dc/95/b3035c9a5987661b9579a247bdb9d76a.jpg,1,169013,Ulefone,29931445
42,"Điện thoại Ulefone Armor 14 pro (chống nước,chống va đập,pin khủng,pin 10.000mAh,Ram 8Gb,Rom 128Gb)- hàng chính hãng",5990000,"·Chú ý : Đối với điện thoại chống nước quý khách nên đậy thật kỹ nút sạc,tai nghe,khe sim khi sủ dụ       Pin Beast 10000mAh Viên pin 10000mAh khổng lồ bên trong hoàn toàn có thể đáp ứng nhu cầu sử dụ...",https://salt.tikicdn.com/cache/280x280/ts/product/cc/02/3a/1d54b42c01e58cfcc866585cb61f7ee6.jpg,1,169013,Ulefone,181266509
43,"Điện thoại Itel it9200 4G - WIFI - Xem YTB , FB - Hàng chính hãng",569000,"Thắng Thao Mobile cam kếtMáy chuẩn 4G không lo cắt sóng 2GHàng chính hãng mới 100%Bảo hành 12 thángCấu hình Điện thoại Itel it9200 4G️Màn hình: TFT LCD2.4""262.000 màu️SIM: 2 Micro SIMHỗ trợ 4G️Danh ...",https://salt.tikicdn.com/cache/280x280/ts/product/19/a0/92/8351ed8fb2cc451eb67df2218bf06b98.jpg,1,111684,Itel,181452535
44,Máy đọc sách Kobo Sage - hàng nhập khẩu,7860000,"Bản nâng cấp của Kobo Forma mới ra mắt, mở bán lần đầu trên thế giới ngày 20/10/2021. Libra 2 và Sage là những chiếc máy đọc được mong chờ nhất cuối năm 2021. ĐẶC TRƯNG CỦA DÒNG MÁY:KÍCH THƯỚC MÀN:...",https://salt.tikicdn.com/cache/280x280/ts/product/fc/f3/0e/bcb04712f34c9c6ee327b9bc95c10b22.jpg,1,183625,Kobo,140940220
45,Điện thoại Masstel FAMI 60 4G Pin 2000 mah - Hàng chính hãng,649000,"Masstel Fami 60 là chiếc điện thoại phổ thông dành tặng riêng cho người cao tuổi với thiết kế gọn gàng, màn hình rõ nét và cụm loa ngoài cực lớn cùng pin “siêu trâu”, hỗ trợ công nghệ đàm thoại LTE 4G...",https://salt.tikicdn.com/cache/280x280/ts/product/fa/88/08/8bb05994e47a72ff697a390072e398ce.jpg,1,112638,Masstel,167466044
46,"Điện thoại Masstel IZI 20 4G , Pin 1700 mAh - Hàng chính hãng ",429000,"Cấu hình Điện thoại Masstel IZI 20 4G Màn hình: TFT LCD1.77""262.000 màuSIM: 2 Nano SIMHỗ trợ 4G VoLTEDanh bạ: 500 sốThẻ nhớ: MicroSD, hỗ trợ tối đa 32 GBCamera sau: 0.08 MPRadio FM: FM không cầ...",https://salt.tikicdn.com/cache/280x280/ts/product/2b/70/5a/65dbd5a01e1b4742064d41f55a230ce0.jpg,1,112638,Masstel,167465704
47,"Điện Thoại Người Già Masstel Fami 60 4G - Loa To, FM Không Dây, Đọc Số Bằng Giọng Nói, SOS, Đèn Pin Kép,... Hàng Chính Hãng",675000,"  Điện Thoại Người Già Masstel Fami 60 4G - Loa To, FM Không Dây, SOS, Đọc Số Bằng Giọng Nói, Đèn Pin Kép, Hỗ Trợ 4G LTE, MỚI 100%, CHÍNH HÃNG 100% được phân phối chính thức tại DI ĐỘNG IZI.    SHOP...",https://salt.tikicdn.com/cache/280x280/ts/product/87/33/ab/1c538e6b6ec69cab99a47bfa7f63c3f7.jpg,1,112638,Masstel,170448099
48,"Máy đọc sách Kobo Libra H20 8GB Trắng/Đen có đèn nền vàng, chống nước - Hàng nhập khẩu",4499000,Máy đọc sách Kobo Libra H2O cung cấp dung lượng lưu trữ 8GB. Màn hình có tính năng Comfort Light Pro  phát ra màu sắc tối ưu dựa trên thời gian trong ngày. Pin có thể kéo dài hàng tuần.Máy Kobo Libra...,https://salt.tikicdn.com/cache/280x280/ts/product/2c/12/8f/6530deee7b232c8616d9bb42fbe2129d.jpg,1,183625,Kobo,74776150
49,"Điện Thoại Bàn Không Dây Lắp Các Loại Sim Di Động Cố Địnḥ Viettel, Mobiphone, Vinaphone",799000,"Điện thoại bàn Điện thoại cố định không dây Dòng cố định không dây lắp SIM Lắp SIM cố định hoặc SIM di động đều được Lắp tất cả các loại SIM của tất cả các thị trường hiện có Viettel, Vina, Mobi, Viet...",https://salt.tikicdn.com/cache/280x280/ts/product/c6/16/a4/e0169694449afe63f489d7a3c81facf4.jpg,1,111461,OEM,144200408
50,Điện thoại Masstel Fami 65 4G - Tặng dock sạc - Gọi HD Call - Hàng chính hãng,669000,"Thắng Thao Mobile cam kếtMáy chuẩn 4G không lo cắt sóng 2GHàng chính hãng mới 100%Bảo hành 12 tháng Thông tin chi tiết  Màu Sắc :Black, Blue, Gold Màn hình: 2.31 inch QVGA Hỗ Trợ Thẻ Nhớ: Mic...",https://salt.tikicdn.com/cache/280x280/ts/product/61/6d/ea/72e56bc245d1f948a43dc11ac05507b6.jpg,1,112638,Masstel,197666071
51,Điện thoại Panasonic KX-TSC11MX -Hàng chính hãng,599000,"Hiển thị số gọi đến và gọi đi (nhớ được 50 số gọi đến và 20 số gọi đi ).Kiểm tra, xóa, và gọi lại số gọi đến và gọi đi.Tự động điền mã vùng và mã di động vào số máy bạn gọi.Tự động phân biệt và gọi...",https://salt.tikicdn.com/cache/280x280/ts/product/95/db/22/273ba8c5adddf25e7a57281e1d7e47b7.jpg,1,18804,Panasonic,117929342
52,Điện thoại bàn không dây Panasonic KX-TGD312 - Hàng Chính Hãng,2090000,"Dù với sự phát triển ngày càng mạnh mẽ và thông dụng của điện thoại di động, nhưng chiếc điện thoại bàn vẫn luôn gắn bó và có mặt trong mọi gia đình Việt. Điện thoài bàn ngày nay đã được cải tiến với ...",https://salt.tikicdn.com/cache/280x280/ts/product/89/54/f7/30ab541c229501e179bb3788eba97b3b.jpg,1,18804,Panasonic,11251711
53,Điện thoại để bàn Panasonic KX-TS880 hàng chính hãng,1150000," Được thiết kế đơn giản, thanh thoát nhưng rất sang trọng. Với nhiều màu sắc khác nhau, thiết bị cho bạn có thể lựa chọn màu sắc phù hợp với căn phòng của mình. Panasonic KX- TS840 thích hợp dùng tron...",https://salt.tikicdn.com/cache/280x280/ts/product/66/f6/8c/d27276cd9a9849356dc5382f03a18972.jpg,1,18804,Panasonic,16521748
54,Điện Thoại Bàn Panasonic KX-TSC11 - Hàng Chính Hãng,689000,"Thiết kế nổi bật, tiện íchĐiện Thoại Bàn Panasonic KX-TSC11 được thiết kế đơn giản, thanh thoát nhưng rất sang trọng. Với màu sắc bắt mắt KX-TS500 làm cho căn phòng của bạn thêm nổi bật. Máy thích hợ...",https://salt.tikicdn.com/cache/280x280/ts/product/1e/d0/02/a1ddac9b56a2df5a4e1aa925eab04a22.jpg,1,18804,Panasonic,4048581
55,Điện thoại bàn không dây Panasonic KX-TGC313 - Hàng Chính Hãng,2200000,"Dù với sự phát triển ngày càng mạnh mẽ và thông dụng của điện thoại di động, nhưng chiếc điện thoại bàn vẫn luôn gắn bó và có mặt trong mọi gia đình Việt. Điện thoài bàn ngày nay đã được cải tiến với ...",https://salt.tikicdn.com/cache/280x280/ts/product/d4/7e/c9/72e19580d556fa02d030cc6e77d1c6fd.jpg,1,18804,Panasonic,23142193
56,Paperwhite 5 (11th-generation) - 2021 - Hàng Nhập Khẩu,5499000,"- Màn hình : 6.8Inch, mật độ hiển thị màn hình 300ppi, đèn điều chỉnh 16 cấp độ- Kích thước : 4.9” x 6.9” x .32” (124.6 x 174.2 x 8.1 mm)- Trọng lượng : 7.23 oz (205 g)- Dung lượng : 8GB hoặc 32GB(bản...",https://salt.tikicdn.com/cache/280x280/ts/product/b9/f0/0c/de7e0ea4ebf22306441e3d7e9279cc25.jpg,1,111461,OEM,128895957
