id,name,price,description,image,category_id,brand_id,brand_name,tiki_product_id
1055,Apple Pencil 2 - MU8F2,2690000,"Nội dung tính năngApple Pencil (thế hệ thứ 2), sức sống tươi mới cho công việc, trên từng đường nét. Gần như không có độ trễ, lại chính xác hoàn hảo đến từng điểm ảnh, tính năng nhạy với độ nghiêng v...",https://salt.tikicdn.com/cache/280x280/ts/product/41/e4/8d/037f72fc4710b8299191650760870276.jpg,6,17827,Apple,123847933
1056,Bàn phím có dây Dell KB216 USB - Hàng Chính Hãng,156000,"Giới thiệu sản phẩm Bàn phím KB216 Bàn phím KB216 là sản phẩm của hãng, thương hiệu máy tính nổi tiếng thế giới. Đây là sản phẩm được ưa chuộng bởi rất nhiều người dùng máy tính.Chi tiết sản phẩm...",https://salt.tikicdn.com/cache/280x280/ts/product/23/29/27/d674ca321e36fd7cef57015773c1f306.jpg,6,18805,Dell,36007224
1057,Tai nghe Remax RM-201 - Hàng chính hãng,109250,"Muốn nghe nhạc HAY, CHỐNG ỒN cực đỉnh, giá cả phải chăng, chế độ bảo hành tốt thì chỉ có mua   ́ ̂  ------------------------- Thiết kế nhét nửa tai độc đáo Tích hợp bộ phím giúp bạn điều khiển ở...",https://salt.tikicdn.com/cache/280x280/ts/product/77/fc/43/d2879cc61f73fb5c209a583ea9eb067c.jpg,6,111454,Remax,123518348
1058,Bộ Thu Phát Bluetooth TP-Link UB400 USB Nano Bluetooth 4.0 - Hàng Chính Hãng,119000,Bộ Chuyển Đổi USB Nano Bluetooth 4.0 TP-Link UB400 - Hàng Chính HãngBluetooth 4.0 – Áp dụng Bluetooth 4.0 mới nhất với công nghệ tiết kiệm năng lượng (BLE) và thiết bị tương thích ngược với Bluetoot...,https://salt.tikicdn.com/cache/280x280/ts/product/66/07/85/9239ee60729c18c92f5393841d4864f4.jpg,6,27464,TP-Link,19419738
1059,"Dây Cáp Dù Lõi HDMI 2.1 8K 48Gbps, 4K 165Hz Dài 2M CHOETECH XHH01 Dùng Cho Tivi/ Máy Tính/ Playstation - Hàng Chính Hãng",219000,"MÔ TẢ SẢN PHẨM8K HDR 60Hz: Cáp HDMI 8K Choetech hỗ trợ độ phân giải đến 8K 60Hz giúp cho bạn cảm nhận giõ nét hình ảnh và video sống động,mượt mà hơn. Cáp còn tương thích với 4K @ 165Hz, 2K, 1080P,48...",https://salt.tikicdn.com/cache/280x280/ts/product/3c/11/d0/39b4b907f7d0082847d30ebba8d31524.png,6,246045,CHOETECH,88798139
1060,Chuột không dây Logitech SIGNATURE M650 Wireless/Bluetooth - Hàng Chính Hãng,630000,"Tính năng SmartWheelBiến việc cuộn chuột trở nên hữu ích cho bạn với SmartWheel của Logitech. Đạt độ chính xác từng dòng khi bạn cần tập trung vào chi tiết, và cuộn siêu nhanh khi bạn chỉ muốn lướt...",https://salt.tikicdn.com/cache/280x280/ts/product/ac/ab/9b/6e190f68f181df1b6aa6d504a7b7a835.jpg,6,18984,Logitech,162772687
1061,"Tấm Lót Chuột, Thảm Da Trải Bàn Làm Việc VinBuy, Miếng Di Chuột Cỡ Lớn 40cmx80cm - Hàng Chính Hãng ",95000,"Tấm Lót Chuột, Thảm Da Trải Bàn Làm Việc, Miếng Di Chuột Cỡ Lớn 40cmx80cm - Hàng Chính Hãng VinBuy Kích thước miếng lót chuột siêu rộng 80 x 40 cm, giúp game thủ thoải mái khi di chuyển tay Giúp việ...",https://salt.tikicdn.com/cache/280x280/ts/product/9e/c1/f3/a035b644ec01cb9fceb8d5b46e57920b.jpg,6,4224691,VinBuy,137864606
1062,Chuột Không Dây Logitech M331 Silent - Hàng Chính Hãng,318000,"Thiết kế sang trọngChuột Không Dây Logitech M331 Silent được thiết kế với các đường cong uốn lượn, bo tròn và ôm sát lòng bàn tay, giúp người sử dụng giảm bớt sự đau mỏi của cổ tay và ngón tay. Hai b...",https://salt.tikicdn.com/cache/280x280/ts/product/c1/0c/8f/3ef244858087cac251f3f3cc3ebbcd9f.png,6,18984,Logitech,299461
1063,Dây Cáp Sạc Li.ght.ning Cho i.Phone Anker PowerLine II 1.8m - A8433 - Hàng Chính Hãng,258000,"Kích thước nhỏ gọnCáp Sạc Lightning Anker Powerline II A8433 có thiết kế nhỏ gọn, độ dài 1.8m tiện dụng cho bạn kết nối nhanh chóng với các thiết bị khi ở khoảng cách xa một cách dễ dàng.Mạnh hơn ...",https://salt.tikicdn.com/cache/280x280/media/catalog/producttmp/cf/20/12/0ead172bdb364659b7d952a62f51a469.jpg,6,50629,ANKER,1060082
1064,Thẻ Nhớ Micro SDXC Samsung Evo Plus U3 130MB/s 128GB New  - Hàng Nhập Khẩu,290000,"Tốc độ đọc ghi lên tới 130MB/sThẻ nhớ Samsung Evo Plus microSDXC có thể đạt được tốc độ đọc tối đa lên tới 130MB/s, cho phép giảm thiểu thời gian chờ đợi mỗi khi bạn muốn trao đổi, lưu trữ dữ liệu q...",https://salt.tikicdn.com/cache/280x280/ts/product/cc/39/b1/d9bf840dea015d9332c0d77043082791.jpg,6,18802,Samsung,171657209
1065,Sim 4G Mobifone 12FD50 Tặng 150GB/Tháng(5GB/Ngày) Trọn Gói 1 Năm- Hàng Chính Hãng - Mẫu ngẫu nhiên,750000,"Sim 4G Mobifone 150GB/Tháng (5GB/Ngày)Sim trọn gói 12 Tháng không cần nạp phí duy trì.Sim 3 trong 1 (MICRO, NANO) phù hợp với mọi thiết bị sử dụng.Có thể sử dụng cho điện thoại, bộ phát wifi, USB, ...",https://salt.tikicdn.com/cache/280x280/ts/product/40/f6/d6/e73b2e8ce437ccab57468614d1571e1a.jpg,6,26675,Mobifone,3671793
1066,Đồng Hồ Pomodoro Hẹn Giờ 60 Phút Kim Loại Nhiều Kiểu Dáng,119000,"Đồng hồ hẹn giờ cơ học Pomodoro sử dụng cơ chế nạp dây cót để hẹn giờ mà không cần dùng pin.Thời gian hẹn giờ từ 5 - 60 phút, giúp bạn trong việc học tập, làm bếp,Cách dùng: vặn đồng hồ tới phút 55, s...",https://salt.tikicdn.com/cache/280x280/ts/product/96/4a/a7/996cd070654b2e5762720bb5d35fca03.jpg,6,111461,OEM,71091864
1067,Chuột Không Dây HXSJ X50 Plus - Hàng Chính Hãng,129000,"Thiết kế sang trọngChuột Không Dây HXSJ X50 được thiết kế với các đường cong uốn lượn, bo tròn và ôm sát lòng bàn tay, giúp người sử dụng giảm bớt sự đau mỏi của cổ tay và ngón tay. Hai bên thân chu...",https://salt.tikicdn.com/cache/280x280/ts/product/24/08/55/446d780e038704734fb82e3ef28df51f.jpg,6,302375,HXSJ,56889347
1068,"Chuột Không Dây PIX-LINK P100 Wireless 2.4Ghz Sạc Pin, Chống Ồn, DPI1600 Dùng Cho Máy Tính, Laptop, Tivi-Hàng Chính Hãng",94000,"Chuột không dây PIX-LINK P100 wireless 2.4Ghz sạc pin, chống ồn, DPI1600 dùng cho máy tính, laptop, tiviHàng chính hãng✿Chuột Không Dây Sạc Điện PIX-LINK P100 Được thiết kế đơn giản, hiện đại, mà...",https://salt.tikicdn.com/cache/280x280/ts/product/65/02/25/e715ada9618709388f7a85afbed6db72.jpg,6,199239,PIX-LINK,174593840
1069,Ốp lưng dẻo mỏng dành cho iPhone 11 / 12 / 13 / 11 Pro / 12 Pro / 13 Pro / 11 Pro Max / 12 Pro Max / 13 Pro Max / 12 Mini / 13 Mini - Hàng chính hãng,49000,ỐP LƯNG DẺO MỎNG DÀNH CHO IPHONE 11 / 12 / 13 / 11 PRO / 12 PRO / 13 PRO / 11 PRO MAX / 12 PRO MAX / 13 PRO MAX / 12 MINI / 13 MINI - HÀNG CHÍNH HÃNG...,https://salt.tikicdn.com/cache/280x280/ts/product/e6/24/0c/b4514ba8b89c307a07114d2e6b68ff63.jpg,6,625265,Photodesign VN,161007768
1070,Tai Nghe Bluetooth Chụp Tai Sony WH-1000XM5 Hi-Res Noise Canceling - Hàng Chính Hãng,6990000,"Tai nghe Sony WH-1000XM5 - Chống ồn dịu tai, sử dụng thoải máiSony WH-1000XM5 với thiết kế chống ồn dòng cao cấp, được trang bị bộ xử lý QN1. Đây là một trong những tai nghe chụp tai tốt trong phân k...",https://salt.tikicdn.com/cache/280x280/ts/product/8e/90/30/9d9d8395795c941007735d4023992da9.png,6,18641,Sony,181772131
1071,Thẻ nhớ Micro SD Hikvision 32GB 64GB 128GB Class 10 tốc độ 92MB/s - Hàng chính hãng,120000,"Lưu ý: Nhiều trường hợp do dùng thẻ nhớ không chính hãng nên camera không nhận thẻ nhớ, trong trường hợp đó shop không hỗ trợ lỗi đọc thẻ nhớ. Để được hỗ trợ tốt nhất hãy mua kèm thẻ nhớ của shop.- K...",https://salt.tikicdn.com/cache/280x280/ts/product/3f/64/e9/bd1068527fcd9c8a29f0fba39b2b08f6.jpg,6,174069,Hikvision,170273830
1072,Đầu Chuyển HDMI ra VGA,37500,- Vật liệu nhựa - Chỉ dùng 1 chiều từ HDMI sang VGA - Hỗ trợ đến độ phân giải 1080p - Chuyển đổi tín hiệu kỹ thuật số của bạn với các tín hiệu analog - Cắm tự nhận - Chiều dài cáp: 20cm - Tương ...,https://salt.tikicdn.com/cache/280x280/ts/product/d7/64/2a/659a47166e0a0da73d4ef7113b6c04d0.jpg,6,111461,OEM,15251528
1073,"Kính Cường Lực Kingkong iPhone, Màn Nhám Chống Vân Tay Dành Cho Game Thủ - Full Hộp - Hàng Chính Hãng",124000,"Kính Cường Lực KingKong 3D Màn Nhám - Chống Vân Tay, Cực Phẩm Cho Các Game Thủ!!!   * THÔNG TIN SẢN PHẨM:- Cường lực Kingkong siêu cứng, chính hãng WK, màn nhám, full màn, chống vân tay cho iPhone...",https://salt.tikicdn.com/cache/280x280/ts/product/63/06/12/6403544c8695ffa7cc08e86e811bde5a.jpg,6,155563,WK,176752662
1074,Chuột không dây Bluetooth  HXSJ M90 - Hàng chính hãng,139000,"Mode: M90Chất liệu: ABS cao cấp, nhỏ gọn, thời trangThiết kế: Hiện đạiĐộ phân giải quang điện: 800,1200,1600Kết nối : Không dây 2.4GHz, BluetoothChế độ hoạt động: Quang điện tửĐiện áp định mức / dòng ...",https://salt.tikicdn.com/cache/280x280/ts/product/5f/78/7d/03b63818ba8ac20348dfb5d10a76daee.jpg,6,302375,HXSJ,56608719
1075,Bút Cảm Ứng Dành  Cho SMARTPHONE VÀ IPAD -Giao  Màu  Ngẩu Nhiên,6430,"Thiết kế với nhiều màu sắc khác nhau, viết cầm vừa tay người sài, tạo cảm giác thoải mái khi viếtPhù hợp với nhiều dòng máy khác nhau như: iphone ,samsung, oppo,  và máy tính bảng...",https://salt.tikicdn.com/cache/280x280/ts/product/9a/d5/54/f57d74aa8336a02afc1da133eb7ac38e.JPG,6,111461,OEM,13119283
1076,"Cây chọt sim điện thoại, que chọc sim để sau ốp lưng dành cho iphone 5/5s/6/6plus/6s/6s plus/6/7/7plus/8/8plus/x/xs/xs max",4000,"+ Que chọc sim loại chất lượng cao cấp có thể đeo chìa khóa, để sau ốp lưng rất tiện dụng- Dùng được cho các loại điện thoại có lỗ chọc sim- Quý khách hãy bớt chút thời gian khi nhận hàng xong thì h...",https://salt.tikicdn.com/cache/280x280/ts/product/d1/98/3f/000a396769e17acb1288d6d9bb1653fd.jpg,6,111461,OEM,123843835
1077,"Giá Đỡ Điện Thoại , Máy Tính Bảng Có Thể Gấp Gọn, Chống Trượt, Tùy Chỉnh Độ Cao - DT056",26500,"Giá Đỡ Điện Thoại , Máy Tính Bảng Có Thể Gấp Gọn, Chống Trượt, Tùy Chỉnh Độ Cao - DT056Chất liệu: Nhựa cứng Tổng Hợp ABS bền đẹp.Thiết kế: Có thể gập gọn, trục xoay độ nghiêng từ 0 - 90 độ.Kích thước...",https://salt.tikicdn.com/cache/280x280/ts/product/06/a9/27/c6cb94b0b68fb98cb4f20c16e74eb8ba.jpg,6,111461,OEM,63912442
1078,Bộ điều khiển thông minh Google Chromecast with Google TV - Hàng Nhập Khẩu,1265000,"Thiết bị là chuẩn 4K Google Chromecast with Google TV là thiết bị trình chiếu nội dung mới nhất của “gã khổng lồ” Google phát triển, được tích hợp thêm rất nhiều tính năng nổi bật so với dòng sản phẩ...",https://salt.tikicdn.com/cache/280x280/ts/product/89/d7/41/c844ffb79619aff3d044e2a28725b25c.png,6,177927,Google,73324095
1079,Đầu đọc thẻ nhớ 2.0 Hoco HB20 Mindful - hỗ trợ khe microSD/SD (Hàng chính hãng),75000,"Đầu đọc thẻ nhớ 2.0 Hoco HB20 Mindful - hỗ trợ khe microSD/SD (Đen) Thông số:HB20 Đầu đọc thẻ 2 trong 1 USB2.0 có tâm, hỗ trợ thẻ TF / SD, khả năng tương thích rộng1. Chất liệu: ABS.2. Kích thước...",https://salt.tikicdn.com/cache/280x280/ts/product/80/bf/0f/d871dc729c9420d0306af903717fee80.jpg,6,21653,Hoco,76067387
1080,"HUB TYPE C Và HUB USB 3.0 Tốc Độ Cao Chia 4 Cổng VinBuy, HUB Chuyển Đổi Dành Cho Macbook Pro Laptop PC Hỗ Trợ Sạc Pin Kết Nối Đa Năng Ổ Cứng Bàn Phím Chuột Máy In, Thiết Bị Ổ Chia USB - Hàng Chính Hãng",87000,"HUB TYPE C Và HUB USB 3.0 Tốc Độ Cao Chia 4 Cổng VinBuy, HUB Chuyển Đổi Macbook Pro Laptop PC Hỗ Trợ Sạc Pin Kết Nối Đa Năng Ổ Cứng Bàn Phím Chuột Máy In, Thiết Bị Ổ Chia Usb - Hàng Chính Hãng  ...",https://salt.tikicdn.com/cache/280x280/ts/product/e0/ca/fc/8a1ef99e1842799787837509cae373bb.jpg,6,4224691,VinBuy,167528098
1081,Kính Cường Lực Chống Nhìn Trộm KingKong Dành Cho iPhone - Full Hộp - Dán Full Màn - Hàng Chính Hãng ,134500,"Kính Cường Lực KingKong Chống Nhìn Trộm Dành Cho iPhone X/ XS/ XS Max - 11/ 11Pro/ 11Pro Max, iPhone 12-12Pro, 12ProMax, iPhone 13-13Pro, 13ProMax, iPhone 14, 14Plus, 14Pro, 14Pro, 14ProMax - Full Hộp...",https://salt.tikicdn.com/cache/280x280/ts/product/64/b2/ed/22b998ab86f999a02bc48a7dbe9c383e.jpg,6,274577,Kingkong,80857582
1082,Bàn phím có dây Logitech K120 - Hàng chính hãng,141000,"Thiết kế chống tràn, bền bỉ Bàn Phím Logitech K120 với  thiết kế chống tràn hiệu quả, chất lỏng sẽ tự chảy ra ngoài nên bạn sẽ  không còn lo lắng về sự cố vô tình làm đổ chất lỏng lên trên bàn phím. ...",https://salt.tikicdn.com/cache/280x280/ts/product/01/c9/b9/4c92a02dbf8def20c13076cbf2d1c28f.jpg,6,18984,Logitech,359484
1083,"Cáp sạc nhanh siêu bền C to IP Baseus Dynamic Series FAST CHARGING DATA CABLE 20W dùng cho IP 13,12,... - Hàng chính hãng",105000,"Cáp Sạc C to IP : Cáp sạc nhanh siêu bền C to IP Baseus Dynamic Series FAST CHARGING DATA CABLE 20W  Tính năng cơ bản Cáp sạc nhanh C to IP 20W cho iPhone 13, 12, vv... Series Baseus  Dynamic Ser...",https://salt.tikicdn.com/cache/280x280/ts/product/10/7d/2c/1e24eb549e351ca6da42c145a91a1fa8.jpg,6,21651,Baseus,179541784
1084,Dây Đeo Thay Thế Viền Dành Cho Vòng Đeo Tay Thông Minh Xiaomi Mi Band 5/ Miband 6 - Hàng chính hãng,41000,"Được làm bằng chất liệu TPU chất lượng, an toàn và thân thiện với mội trườngSử dụng đơn giản và dễ dàng, nhiều màu sắc để lựa chọnThời trang, sành điệu và bền bỉ, độ mềm vừa phải, dẻo, đeo rất thoải m...",https://salt.tikicdn.com/cache/280x280/ts/product/7f/55/7c/eaff8211b82a5ebb406ab139b08950e0.jpg,6,4973949,Kai Nguyễn,191502436
1085,Dây Nguồn Laptop 1.5m,55000,"Dây Nguồn Laptop 1.5m Dây nguồn 3 chấu loại dây dẹt chất lượng tốt, rất an toàn cho người sử dụng và laptop.Dùng được cho tất cả các dòng laptop...",https://salt.tikicdn.com/cache/280x280/ts/product/cf/5d/ff/f1cfe3ef44b1161b0d61c18a5f4b39f8.jpg,6,111461,OEM,74343712
1086,Đồng hồ Thông minh Trẻ em Model Q15 lắp SIM nghe gọi 2 chiều 3 màu Xanh Hồng Đen Hàng chính hãng,400000,"Giới thiệu Đồng hồ Thông minh 2022SẢN PHẨM MỚI THƯƠNG HIỆU AMAModel AMA Watch Q15- AMA Watch Q15 là mẫu Đồng hồ Thông minh mới nhất dành cho Trẻ em, sản phẩm được xuất xưởng và bày bán tại sàn Ti...",https://salt.tikicdn.com/cache/280x280/ts/product/4f/a0/c2/c978a931be8bc02a10e4d7058ea72210.jpg,6,2630119,AMA,154835064
1087,Thẻ Nhớ Camera Hikvision 64Gb Class 10 ( Chuyên dùng cho Camera IP ) - Hàng Chính hãng,95000,"Thẻ Nhớ Camera Hikvision 64Gb Class 10 ( Chuyên dùng cho Camera IP )Thẻ nhớ Hikvision Hành Chính Hãng Tốc độ 92m/s sản phẩm sử dụng đa năng có thể dung lắp cho điện thoại, camera quan sát, máy ảnh ...",https://salt.tikicdn.com/cache/280x280/ts/product/f5/f1/1d/abce956264e1c38ea0f1ea088a5ea80d.jpg,6,174069,Hikvision,67517393
1088,CỐC SẠC NHANH 15W 2 CỔNG CHỐNG CHÁY NỔ HOCO C73 - CỦ SẠC ĐA NĂNG 2.4A CHO CÁC DÒNG ĐIỆN THOẠI CHÍNH HÃNG,69000," Củ Sạc Nhanh 2 Cổng USB C73 Dòng ra 2.4AĐặc điểm nổi bật1. Đầu vào: AC100-240V, 50 / 60Hz, 0.4A.2. Đầu ra USB 1/2: 5V-2.4A. Tổng sản lượng: tối đa 5V-2.4A.3. phích cắm tiêu chuẩn Mỹ.4. Chất liệ...",https://salt.tikicdn.com/cache/280x280/ts/product/6f/73/21/8ac24c8e99dd346d542b37693dd29f20.jpg,6,21653,Hoco,56049649
1089,"Đồng Hồ Thông Minh cho Trẻ em 6 tuổi, 7 tuổi, 8 tuổi, 9 tuổi, 10 tuổi, 11 tuổi Lắp Sim Độc lập nghe gọi 2 chiều AMA Watch Y92 Chống nước Định vị Wifi độ chính xác cao Hàng nhập khẩu",577000,"GIỚI THIỆU SẢN PHẨMĐồng hồ Thông minh AMA Watch Y92Định vị WifiThông tin và Chức năng- AMA Watch Y92 là mẫu Đồng hồ Thông minh dành cho Trẻ em, tuổi phù hợp nhất để đeo chiếc đồng hồ này là từ 6 - 1...",https://salt.tikicdn.com/cache/280x280/ts/product/ba/a8/be/bc906fde236a6c5f25bbe2cfeee3a8af.jpg,6,2630119,AMA,112287571
1090,Pin Sạc Dự Phòng Anker PowerCore Select 10000mAh - A1223 - Hàng Chính Hãng,600000,"Kích thước đáng kinh ngạcPin Sạc Dự Phòng Anker PowerCore Select 10000mAh - A1223 có kích thước chỉ to hơn một chút so với thẻ ATM của bạn và có thể cầm vừa vặn trong lòng bàn tay. Ngoài ra, cho dù b...",https://salt.tikicdn.com/cache/280x280/media/catalog/producttmp/81/90/1f/337cd1853e7b3d78b6198892de14e5b5.jpg,6,50629,ANKER,44232101
1091,Thẻ Nhớ Lexar MICRO 633X Tốc Độ 100mb/s - Hàng Chính Hãng,169000,"Thẻ Nhớ Lexar MICRO 633X Tốc Độ 100mb/s Class 10ĐẶC ĐIỂM NỔI BẬTGiải pháp bộ nhớ cao cấp cho điện thoại thông minh, máy tính bảng hoặc action-camera, camera hành trình, fly-camNhanh chóng chụp, p...",https://salt.tikicdn.com/cache/280x280/ts/product/31/a9/3d/853709617775fbbd6231aeda741fa29f.png,6,220233,Lexar,145495427
1092,"Miếng Kê tay, Thanh Kê Tay Bàn Phím Cực Dễ Thương Nhiểu Mẫu Mới_ Hàng Chính Hãng",136843,"Bề mặt miếng kê tay cực kỳ êm ái, thích hợp cho các bạn hay dùng bàn phím vi tính, bàn phím máy tính bàn, chống đau cổ tay. _ Đế miếng kê tay chống trượt cực tốt. _ Chất liệu: Vải lụa sữa (Milk Si...",https://salt.tikicdn.com/cache/280x280/ts/product/f4/82/89/666354194fbc4cf35bce6d14f5b0ef94.jpg,6,111461,OEM,107071890
1093,"Thẻ nhớ chuyên camera Mirco SD HIKVISION  64G - 32GB - 92MB/s, chuyên ghi hình cho camera, máy ảnh, ... Hàng nhập khẩu",67500,"Thẻ nhớ HIKVISION Mirco SD 64G - 32GB - 92MB/s chuyên ghi hình cho camera, máy ảnh, Hàng nhập khẩuThông số kỹ thuậtThẻ nhớ HIKVISION Mirco SD 64G - 32GB - 92MB/s Chuyên dùng cho Camera, điện thoại, ...",https://salt.tikicdn.com/cache/280x280/ts/product/eb/18/62/868aaa31c70507d2fd977b6640bfece5.jpg,6,174069,Hikvision,112087792
1094,Đồng hồ Thông minh Chống nước IP67 Dành cho Trẻ em nhuẩn AMA Watch Q16S Hàng chính hãng ,395000," GIỚI THIỆU SẢN PHẨM Đồng hồ Thông minh Trẻ emĐịnh vị GPS, Chống nước IP67AMA Watch Q16SĐồng hồ Thông minh Q16S Thương hiệu AMA là sản phẩm mới năm 2022, đây là phiên bản nâng cấp của dòng đồng h...",https://salt.tikicdn.com/cache/280x280/ts/product/85/2c/82/084299fa304692f7dbdc403ced19c368.jpg,6,2630119,AMA,192977208
1095,Cáp ANKER Powerline III Flow USB-C To USB-C - A8552 / A8553 - Hàng Chính Hãng,165000,"Cảm nhận sự khác biệtCáp ANKER Powerline III Flow USB-C To USB-C - A8552 / A8553 - Sau khi cầm trên tay chiếc cáp silicon mềm mại đến bất ngờ này, bạn sẽ không bao giờ quay lại với những chiếc cáp th...",https://salt.tikicdn.com/cache/280x280/ts/product/0f/44/5a/23180be58190ec77f0cdf4db90b361e5.jpg,6,50629,ANKER,195300861
1096,Thẻ Nhớ SanDisk Ultra MicroSDXC UHS-1 100 MB/s Class 10 32GB/64GB/128GB - Hàng Chính Hãng,118000,"Thẻ nhớ MicroSD SanDisk Ultra A1Thẻ nhớ MicroSD SanDisk Ultra A1 cho phép bạn lưu giữ, truyền tải hình ảnh có độ phân giải cao và video Full HD trên điện thoại thông minh Android hoặc máy tính bảng ...",https://salt.tikicdn.com/cache/280x280/ts/product/9c/48/b6/f3eb6fbfc1998c98a5b291c2745d5b1b.png,6,18845,SanDisk,107067035
1097,Phụ kiện giữ dây cáp sạc Giá Silicon mini cố định dây cáp sạc cho các thiết bị điện tử trên bàn làm việc - Hàng Chính Hãng,20000,"Phụ kiện giữ dây cáp sạc Giá Silicon mini cố định dây cáp sạc cho các thiết bị điện tử trên bàn làm việc - Hàng Chính HãngChất liệu:SiliconeChức Năng:Cố định tai nghe, cáp sạcMàu:Black  ...",https://salt.tikicdn.com/cache/280x280/ts/product/18/54/2d/3919a15dcdb692041ddec9b93971e559.png,6,500047,PKCB,53977774
1098,"Hub Chuyển Đổi USB Type C to HDMI CHOETECH HUB-H10 Độ Phân Giải 4K 60Hz, 1080P Cho Tivi/Laptop/Playstation/PC - Hàng Chính Hãng",299000,"  Plug and Play: Cáp USB C to HDMI cho phép bạn kết nối trực tiếp máy tính USB-C với màn hình được trang bị HDMI mà không cần trình điều khiển / phần mềm bổ sung, rất nhanh chóng và dễ dàng. Khả n...",https://salt.tikicdn.com/cache/280x280/ts/product/1f/82/b0/3d6c83a0270be3e42bad3f2730fa103e.png,6,246045,CHOETECH,111978854
1099,Dây Cáp Nối Dài Âm Thanh 2 Đầu Đực 3.5mm Dài 1.2M CHOETECH AUX002 - Hàng Chính Hãng,99000," MÔ TẢ SẢN PHẨM Kết nối truyền tải âm thanh chất lượng cao: Dây cáp Choetech AUX002 cho phép bạn kết nối và truyền tải âm thanh chất lượng cao từ điện thoại di động, máy tính bảng, iPod hoặc máy nghe ...",https://salt.tikicdn.com/cache/280x280/ts/product/e3/39/3d/3ab7e14eae2d829aec96e0665a02b962.png,6,246045,CHOETECH,88796437
1100,Dây cáp VGA 1.5M Đen chống nhiễu loại cực tốt,65000,       :blossom:Cảm ơn khách hàng đã ủng hộ shop:maple_leaf::blossom:   ...,https://salt.tikicdn.com/cache/280x280/ts/product/3d/82/1d/7f3ebe622169b8aba4d3fdcae1c7defa.jpeg,6,111461,OEM,111484548
1101,"Cáp sạc nhanh, truyền dữ liệu tốc độ cao Baseus Cafule Type C cho Samsung S8/S9/ Note8/ Note9/ Xiaomi/ Huawei/ Oppo/Nokia ( 3A, Sạc nhanh Quick charge 3.0, Siêu bền)- Hàng nhập khẩu",75000,"Tính năng cơ bản   Cafule Type C cho Samsung S8/S9/ Note8/ Note9/ Xiaomi/ Huawei/ Oppo/Nokia ( 3A, Sạc nhanh Quick charge 3.0, Siêu bền)- Dùng sạc pin và đồng bộ dữ liệu tốc độ cao cho các Smartphone...",https://salt.tikicdn.com/cache/280x280/ts/product/4d/b2/ff/f21e007074d2ed395f5d48d565855971.jpg,6,21651,Baseus,35420153
1102,"Cường Lực Chống Nhìn Trộm KingKong Dành Cho iPhone X-XS, XS Max, iPhone 11, 11Pro, 11ProMax, iPhone 12, 12Mini, 12Pro, 12Pro Max, iPhone 13, 13Mini, 13Pro, 13Pro Max - Dán Full Màn - Hàng Chính Hãng",118500,Kính Cường Lực KingKong Chống Nhìn Trộm Dành Cho iPhone X Đến --> iPhone 13Pro Max  Phiên Bản Mới iPhone 13 Series Vừa Mới Cập Bến+ Cường lực WK Anti Peeping với tính năng chống nhìn trộm màn ...,https://salt.tikicdn.com/cache/280x280/ts/product/00/4c/55/2d6b8f75d8822c3b261efaa2ecbb55d0.jpg,6,274577,Kingkong,132144149
1103,"Dây cáp sạc nhanh Type-C dài 2M hiệu Baseus Cafule Type C to Type C PD truyền data tốc độ cao  cho Smartphone / Tablet / Macbook / Laptop Type C Samsung Huawei Oppo Xiaomi Vsmart (3A, 60W, Sạc nhanh PD, Sạc nhanh QC 4.0 Quick Charge) - Hàng nhập khẩu",89000,"Dây cáp sạc nhanh Type-c dài 2M truyền data tốc độ cao Baseus Cafule Type C to Type C PD cho Smartphone / Tablet / Macbook / Laptop Type C (3A, 60W, Sạc nhanh PD, Sạc nhanh QC 4.0 Quick Charge)   ...",https://salt.tikicdn.com/cache/280x280/ts/product/1c/33/94/a245d6c4de06663fd0bf247f566b5bde.jpg,6,21651,Baseus,49658272
1104,CÂY CHỌC SIM ĐIỆN INOX - QUE CHỌC SIM INOX HÌNH GIỌT NƯỚC,3100,       -   Que chọc sim inox chọc được lỗ SIM tất cả các thiết bị trên thị trường   - Được làm bằng chất liệu thép không gỉ (inox)   - Có lỗ tiện dụng khi móc và các đồ dùng khác như móc chìa k...,https://salt.tikicdn.com/cache/280x280/ts/product/46/fa/dd/fafeea958cbf11d28e92c2a5851e65e7.jpg,6,111461,OEM,133637826
1105,Tai nghe bluetooth nhét tai chống ồn cao cấp V5.3 chính hãng dùng cho iPhone Samsung OPPO VIVO HUAWEI XIAOMI tai nghe không dây - Hàng Chính Hãng PKCB,320003,Tai nghe bluetooth nhét tai chống ồn cao cấp chính hãng PKCBPhạm vi truyền: 10 métKênh: âm thanh nổiMàu: đen Cảm ứng thông minhChip Bluetooth  mới mượt mà và không bị trễGiảm tiếng ồn...,https://salt.tikicdn.com/cache/280x280/ts/product/3d/79/36/89e01a5c8fe06bedcb0fc60f9032d9f4.jpg,6,500047,PKCB,194458001
1106,"Loa Bluetooth HXSJ V6 Bản Mở Rộng Hỗ Trợ Kết Nối Bluetooth 5.0, Thẻ Nhớ, USB, Công suất 2 loa 10W Nhiều Màu Sắc - Hàng chính hãng",329000,"Loa Bluetooth HXSJ V6Người đồng hành lý tưởng Loa Bluetooth HXSJ V6 Được thiết kế liền mạch với các góc bo tròn mới, cùng chất liệu phủ cao su khiến cho chiếc loa cầm trong tay rất chắc chắn và cứ...",https://salt.tikicdn.com/cache/280x280/ts/product/10/c8/db/baecb8335df7cd87f9d36b811cca1dce.jpg,6,302375,HXSJ,127695415
