id,name,price,description,image,category_id,brand_id,brand_name,tiki_product_id
1513,Sữa Tắm Lifebuoy Sạch Khuẩn Bảo Vệ Vượt Trội Mạnh Mẽ Chứa Ion Bạc+ Hỗ Trợ Cùng Đề Kháng Da Tự Nhiên Chai 1000G,187000,Sữa Tắm Lifebuoy Sạch Khuẩn Bảo Vệ Vượt Trội Mạnh Mẽ Chứa Ion Bạc+ Hỗ Trợ Cùng Đề Kháng Da Tự Nhiên Chai 1000GBẢO VỆ VƯỢT TRỘI 1O Bảo vệ làn da vượt trội với Sữa tắm Lifebuoy Bảo vệ Vượt trội 10 ...,https://salt.tikicdn.com/cache/280x280/ts/product/66/96/39/1969bfe5bebaf32e5152c0db35cf8535.png,8,21266,Lifebuoy,202062554
1514,"Combo 3 Tinh Dầu Sả Chanh + Tinh Dầu Bạc Hà + Tinh Dầu Oải Hương (Lavender) - Tinh Dầu Xông Phòng Nguyên Chất Giúp Thư Giãn, Đuổi Muỗi Và Thơm Phòng (3 chai 10ML)",118000,"Combo 3 Tinh Dầu Sả Chanh (10ML) + Tinh Dầu Bạc Hà (10ML) + Tinh Dầu Lavender (10ML) - mang đến cho bạn không gian sống thoải mái với các mùi hương giúp giảm stress, lấy lại sự an tĩnh.Tinh Dầu Thiên ...",https://salt.tikicdn.com/cache/280x280/ts/product/05/5c/4e/f421195819cdc7d31401c3f17e2edcd6.jpg,8,4246951,TIDAMO Tinh Dầu Số 1,75523405
1515,Bao cao su Durex Performa 3 bao,67000,"Bao cao su Durex Performa được thiết kế đặc biệt để giúp kéo dài cuộc yêu. Durex Performa chứa benzocain 5%, gây tê nhẹ, giúp kéo dài thời gian cương cứng, cho bạn điều khiển cuộc yêu theo cách của r...",https://salt.tikicdn.com/cache/280x280/ts/product/94/1b/40/1cd1d121f2e0d0e3d0bfb2ee93facbc7.jpg,8,21261,Durex,385654
1516,Chỉ nha khoa SGS nhập khẩu Hàn Quốc - 500D hương bạc hà mới,35000,Chỉ nha khoa SGS nhập khẩu Hàn Quốc - 500D hương bạc hàLưu ý khi chọn chỉ nha khoa:Chỉ nha khoa 500D dành cho người có khe răng hẹp hoặc lần đầu sử dụng chỉ nha khoaChỉ nha khoa 840D dành cho người...,https://salt.tikicdn.com/cache/280x280/ts/product/9f/10/0b/d5bf6624a5e6400b4bc61679b15b9ec2.jpg,8,478585,SGS,91565733
1517,Máy Xông Tinh Dầu Tặng 3 Tinh Dầu Sả Chanh + Bạc Hà + Quế. Máy Khuếch Tán Tinh Dầu Có Remote Điều Khiển Từ Xa Chuyên Dụng Xông Tinh Dầu Cho Phòng Lớn,288000,Máy Xông Tinh Dầu Cao Cấp Tặng 3 Chai Tinh Dầu Sả Chanh + Bạc Hà + Quế. Máy Khuếch Tán Tinh Dầu Có Remote Điều Khiển Từ Xa Chuyên Dụng Xông Tinh DầuAuto hẹn giờ tự tắt. Điều khiển từ xa bằng Remote T...,https://salt.tikicdn.com/cache/280x280/ts/product/a6/45/e9/7a6029d5002cfaf358134cea65150556.jpg,8,4246951,TIDAMO Tinh Dầu Số 1,74527291
1518,Túi chườm nóng thảo dược giảm đau nhức mỏi mắt dùng lò vi sóng - Hapaku,250000,"Túi chườm thảo dược dùng cho vùng mắt là sản phẩm kết hợp các loại thảo dược tự nhiên truyền thống, có tác dụng làm giảm nhức mỏi mắt do làm việc nhiều với máy vi tính, giúp đầu óc thư giãn, mang đến ...",https://salt.tikicdn.com/cache/280x280/ts/product/0c/92/0d/abf0116fbdd615d4a2349b17f61d58d9.png,8,110481,Hapaku,186434710
1519,Combo 2 Nước rửa tay Lifebuoy sữa dưỡng ẩm túi 400g,99000,Dòng sản phẩm Lifebuoy giúp bảo vệ khỏi 99.9% vi khuẩn. Công thức chứa ion Bạc+ cùng tinh chất sữa giúp duy trì độ ẩm và mềm mại trên da tay. Thành phần diệt khuẩn tiên tiến Activ5 giúp bảo vệ khỏi vi...,https://salt.tikicdn.com/cache/280x280/ts/product/bf/93/14/134889623534f17a4d3ec6b388afd7e4.png,8,21266,Lifebuoy,58731239
1520,"Dầu gội Selsun chống gàu, sạch gàu & hết ngứa da đầu Selsun Anti-Dandruff Shampoo 50ml",52000,Dầu gội chống gàu Selsun 50mlDầu gội thông thường sẽ không giúp bạn giải quyết được nguyên nhân gây gàu - vi nấm Malassezia một cách hiệu quả. Thứ bạn cần là sản phẩm có thành phần chuyên biệt như Se...,https://salt.tikicdn.com/cache/280x280/ts/product/db/bd/0d/beb266237eb39854dc2a41252055621e.jpg,8,112885,Selsun,20541866
1521,Bao Cao Su Durex Jeans,40000,"Từ năm 1929 đến nay, Durex vẫn luôn sản xuất bao cao su từ những chất liệu tốt nhất, đảm bảo chất lượng cao. Trong hơn 90 năm qua, Durex không ngừng nghiên cứu và đa dạng hóa các dòng sản phẩm ngày c...",https://salt.tikicdn.com/cache/280x280/ts/product/65/d3/8c/cfc55e9e659b7b3e6cfb067bff115b9f.jpg,8,21261,Durex,90683425
1522,Bộ 3 Hộp Silcot Bông Trang Điểm (bông tẩy trang) Nhật Bản Cao Cấp (66 Miếng/Hộp),110000,"Bông Trang Điểm Silcot (66 Miếng/Hộp) là một trong những vật dụng không thể thiếu của các cô nàng đam mê làm đẹp.Đặc điểm nổi bậtBông trang điểm sẽ hỗ trợ cho bạn có được lớp trang điểm hoàn hảo, ...",https://salt.tikicdn.com/cache/280x280/ts/product/ee/f1/51/33f89f156917da2abe6b307b641088c7.png,8,48249,Silcot,2738497
1523,Nước tẩy trang Công Nghệ Micella Bioderma Sensibio H2O - 500ml,425000,"Bioderma Sensibio H2O là dung dịch làm sạch và tẩy trang đầu tiên trên thế giới ứng dụng công nghệ micellar, giúp làm sạch đến 99% bụi bẩn, dầu thừa và lớp trang điểm, đồng thời vẫn tôn trọng hàng rào...",https://salt.tikicdn.com/cache/280x280/ts/product/33/49/3c/387cb381a407cebf918dc43cdf295396.png,8,50662,BIODERMA,50699284
1524,Bộ 3 Kem đánh răng P/S Trà Xanh 230g,116000,Thành phần tự nhiênChiết xuất tinh chất trà xanhĐược biết đến với công thức làm dịu các vấn đề răng miệngKết hợp với công thức P/S vượt trộiGiúp cải thiện khoang miệngCông thức hoạt tínhCho c...,https://salt.tikicdn.com/cache/280x280/ts/product/8b/28/a1/1fd7ccab3d962e8654ac15316ee18ce6.jpg,8,21271,P/S,58731234
1525,Combo Bao cao su Durex Invisible Extra Thin Extra Lubricated 10 Bao và Extra Sensitive 10 Bao,438000,Bao cao su Durex Invisible Extra Thin Extra Sensitive và Invisible Extra Thin Extra Lubricated được thiết kế siêu mỏng nhưng vẫn giữ được độ bảo vệ và an toàn cao.Bao cao su latex với kiểu...,https://salt.tikicdn.com/cache/280x280/ts/product/69/b2/c8/4d2ebddc4422c4fb2bde0754f801ad4f.jpg,8,21261,Durex,92146086
1526,Bao cao su Sagami Spearmint - Hương bạc hà - Hộp 10 chiếc,147000,"       Sagami Spearmint là dòng sản phẩm có mùi hương bạc hà, kiểu dáng cổ điển, nhiều chất bôi trơn của Sagami – Nhà sản xuất bao cao su đầu tiên tại Nhật Bản.   MÔ TẢ SẢN PHẨM   TÍNH NĂNG SẢN ...",https://salt.tikicdn.com/cache/280x280/ts/product/b2/a7/fb/89d357f3217778645bde5a159cf26be8.jpg,8,22095,Sagami,108535197
1527,Kem dưỡng trắng Hada Labo Perfect White Tranexamic Acid Cream 50g,192000,"Thành phần chính và công dụng:Kem dưỡng trắng Hada Labo với công dụng khóa ẩm chuyên sâu, dưỡng da sáng rạng rỡ, giảm thâm sạm sau 7 ngày- Dạng kem mỏng nhẹ, thấm nhanh, không gây nhờn rít- Kem dưỡ...",https://salt.tikicdn.com/cache/280x280/ts/product/00/5e/c4/2bc0c24cb8d7221a7802167b173b6823.jpg,8,22013,Hada Labo,54058501
1528,Gương trang điểm để bàn có đèn LED Xiaomi Jordan Judy NV026 - Hàng Chính Hãng,159000,Gương trang điểm - có đèn LED - PIN 1200mahThông số chi tiết Gương trang điểm NV026:Kích thước toàn phần: 238 x 168 x 25mmKích thước gương: 232 x 162 x 2mmTrọng lượng tịnh: 370gChất liệu: Vỏ nhựa...,https://salt.tikicdn.com/cache/280x280/ts/product/5d/c2/f2/606ba9d4118df884861b98b9d5c3a493.jpg,8,870157,Jordan&Judy,177911621
1529,"Tinh Dầu Xông Phòng Nguyên Chất TIDAMO 50ML, Tự Chọn Mùi | Có Kiểm Định Chất Lượng | Sử Dụng Với Máy Xông Tinh Dầu Giúp Thơm Phòng, Khử Khuẩn, Tốt Cho Sức Khỏe và Làm Đẹp",68000,"Nhiều loại Tinh Dầu Thiên Nhiên, Nguyên ChấtChai lớn: 50MLQuý khách tự chọn loại tinh dầu yêu thích: Sả chanh, Bạc Hà, Cam Ngọt, Vỏ Quế, Vỏ Bưởi, Ngọc Lan Tây, Hoa Hồng, Hoa Lài, Hoa Cúc La Mã, Khuy...",https://salt.tikicdn.com/cache/280x280/ts/product/bf/de/35/2d6839dcb89b10245233af7c4782aaf2.jpg,8,4246951,TIDAMO Tinh Dầu Số 1,91256307
1530,Bộ 2 Chai Nước Súc Miệng làm trắng răng LISTERINE HEALTHY BRIGHT 750mlx2 Chai,281000,"Better For The Planet! Tất cả sản phẩm LISTERINE nay đã được chuyển đổi hoàn toàn thành BAO BÌ TÁI CHẾ & AN TOÀN CHO DÒNG NƯỚC, sự cải tiến ra đời vì mục tiêu chung bảo vệ hành tinh, khuyến khích...",https://salt.tikicdn.com/cache/280x280/ts/product/f7/a3/3e/dfd65ab8c7c3dfacbe9db0f7d6a988aa.jpg,8,41661,LISTERINE,78280123
1531,Viên uống bổ mắt Lutein Rohto V5 ( Hộp 30 viên),480000,"Thực phẩm bảo vệ sức khỏe Rohto V5 (Viên uống sáng mắt Rohto V5 hộp 30 viên) (nhập khẩu từ Nhật Bản)Với kinh nghiệm hơn 150 năm nghiên cứu và phát triển các dòng sản phẩm chăm sóc mắt, lần đầu tiên t...",https://salt.tikicdn.com/cache/280x280/media/catalog/producttmp/de/40/12/6ac2a438a33670f897a986699861a196.jpg,8,22393,Rohto,907522
1532,Sữa Rửa Mặt Neutrogena Làm Sạch Sâu Và Kiểm Soát Nhờn,89000,"Sữa Rửa Mặt Neutrogena Làm Sạch Sâu với thành phần hydroxy acid trong sữa rửa mặt có công dụng lấy đi lượng dầu thừa, lớp bụi bẩn và lớp trang điểm trên da.Sản phẩm giúp da sạch sâu toàn diện, cải t...",https://salt.tikicdn.com/cache/280x280/ts/product/09/0c/2e/e8e84428c5b0fe96f4341c35a5cdcbbe.jpg,8,307609,Neutrogena,35526543
1533,"Tinh Dầu Nguyên Chất Treo Xe Hơi, Treo Phòng Gia Đình| Tự Chọn Mùi, Có Kiểm Định Chất Lượng| Tinh Dầu TIDAMO Treo Thơm Phòng, Khử Mùi Xe Hơi, Thư Giản và Đuổi Muỗi",24000,"Tinh Dầu Nguyên Chất Treo Xe Hơi, Treo Phòng Gia ĐìnhChính hãng TIDAMO, Có Kiểm Định Chất LượngTinh dầu Treo Thơm Phòng, Khử Mùi Xe Hơi, Thư Giản và Đuổi MuỗiQúy khách lựa chọn loại tinh dầu yêu th...",https://salt.tikicdn.com/cache/280x280/ts/product/a2/bb/73/7992676fe9363110a0afb1e180caf72b.jpg,8,4246951,TIDAMO Tinh Dầu Số 1,96593702
1534,Phấn phủ kiềm dầu dạng bột innisfree No Sebum Mineral Powder 5g,113600,"Phấn phủ kiềm dầu dạng bột innisfree No Sebum Mineral Powder 5gCông dụng1. Hút sạch và kiểm soát dầu thừaPhấn phủ kiềm dầu vượt trội, mang lại làn da khô thoáng và mịn màng như da em bé nhờ thành p...",https://salt.tikicdn.com/cache/280x280/ts/product/f2/43/49/99034705be6b7160f345d30a9dfdadd4.jpg,8,202607,Innisfree,25074713
1535,"Túi chườm bụng kinh 700ml, túi chườm nóng giảm đau bụng đau lưng nam tặng nữ",169000,"Túi chườm bụng kinh 700ml, túi chườm nóng giảm đau bụng đau lưng nam tặng nữ*** Đặc điểm:- Dung tích: 700ml- Kích thước: 15 cm * 26 cm- Màu sắc: Rất nhiều màu dễ thương- Thời gian giữ nhiệt lên tớ...",https://salt.tikicdn.com/cache/280x280/ts/product/0e/be/7e/7574e1f68f6ef5e290ab4445c65538e6.png,8,5207801,PH PUHA,128912879
1536,Sữa Tắm pH 5.5 Johnson’s Adult - Dung Tích 750ml,141000,"Sữa Tắm pH 5.5 Johnson’s 2in1 (750ml) Sữa Tắm pH 5.5 Johnson’s 2in1 (750ml) có chứa kem dưỡng ẩm cùng độ pH lý tưởng, cho da bạn luôn mềm mại, mịn màng. Sản phẩm giúp làm sạch da nhẹ nhàng mà không l...",https://salt.tikicdn.com/cache/280x280/ts/product/b4/d2/dc/240c751744e431121721a35ca180d239.jpg,8,41660,Johnson's Baby,116446788
1537,Nước Tẩy Trang Thanh Lọc Và Làm Sạch Sâu Neutrogena Deep Clean Micellar Purifying Water 400ml,168000,"Nước tẩy trang thanh lọc và làm sạch sâu NeutrogenaLoại bỏ lớp trang điểm và bụi bẩn cứng đầu mà phương pháp làm sạch thông thường không làm được, cho làn da sạch, tươi mát*Không cần rửa lại với nướ...",https://salt.tikicdn.com/cache/280x280/ts/product/98/fc/8b/3d0616de4358f19f5c650865b6b69b34.jpg,8,307609,Neutrogena,56381615
1538,Gel bôi trơn Durex Play Warming 100ml,167000,Gel Bôi Trơn Durex Play Warming 39192 (100ml) giúp cuộc yêu trở nên mặn mà và nồng nhiệt hơn. Gel mang lại cảm giác thoải mái cho các nàng khỏi nỗi lo lắng thường trực. Đồng thời giúp cả hai khởi động...,https://salt.tikicdn.com/cache/280x280/ts/product/75/3c/b1/53a136501212038f45b6a6ab37f93c76.jpg,8,21261,Durex,1672211
1539,"Tinh dầu Sả Chanh Thiên Nhiên Cao Cấp 50ML (Lemongrass) - Tinh dầu Sả Chanh Nguyên Chất TIDAMO Giúp Bảo Vệ Sức Khỏe, Kháng Khuẩn, Đuổi Muỗi Và Thư Giãn Tinh Thần",119000,"Tinh dầu Sả Chanh Nguyên Chất Nhập Khẩu (Lemongrass) Tinh dầu Sả Chanh 50ML Giúp Bảo Vệ Sức Khỏe, kháng khuẩn, đuổi muỗi Và Thư Giãn Tinh ThầnLý Do Để Bạn Chọn Tinh Dầu TIDAMO1- Không hóa chất, khôn...",https://salt.tikicdn.com/cache/280x280/ts/product/7b/28/f3/092a9424418bc19aad4020bc59cfc89d.jpg,8,4246951,TIDAMO Tinh Dầu Số 1,73632586
1540,"Kem Làm Mờ Sẹo Thâm, Sẹo Rỗ, Sẹo Lõm Scar Esthetique của Rejuvaskin - thương hiệu hỗ trợ trị sẹo Hoa Kỳ",320000,"Đặc điểm nổi bậtChiết xuất từ tinh chất thiên nhiên Coenzyme Q-10, Pycnogenol, Glucosamin dẫn xuất Vitamin A, Vitamin C … có khả năng phòng nhiễm trùng, sưng tấy và hạn chế các vết thâm hình thành....",https://salt.tikicdn.com/cache/280x280/ts/product/a4/26/ce/194ccd3753a744c2fd17764741882a70.jpg,8,569135,Rejuvaskin,260844985
1541,Sáp Vuốt Tóc Apestomen Volcanic Clay V4 + Lược Bán Nguyệt,249000,Apestomen Volcanic Clay là một thương hiệu về các sản phẩm chăm sóc tóc và tạo kiểu tóc dành cho nam giới hàng đầu tại Singapore. Được nhập khẩu và phân phối chính thức bởi Công ty TNHH Đầu tư thương ...,https://salt.tikicdn.com/cache/280x280/ts/product/cd/9b/8d/3115f9051e33fadd637a091be97b503f.png,8,275197,Apestomen,50736325
1542,Durex Gel Bôi Trơn Play Massage 2 - in- 1 200ml,258000,"Gel Bôi Trơn Durex Play Massage là loại gel mát-xa toàn thân và là chất bội trơn cá nhân làm tăng độ ẩm tự nhiên của âm đạo.Gel massage giúp cuộc yêu trở nên mặn mà và nồng nhiệt hơn, mang lại cảm g...",https://salt.tikicdn.com/cache/280x280/ts/product/18/fb/0d/9362a292257229c169e6b53a60dcfcff.jpg,8,21261,Durex,385574
1543,Máy Đo Nồng Độ Oxy Trong Máu và Nhịp Tim Dạng Kẹp Ngón Tay KINGTECH PULSE SPO2 - Hàng Chuẩn,230000,Chỉ số Oxy trong máu thông báo điều gì ? Chỉ số nồng độ oxi bão hòa SpO2 trong máu rất quan trọng của hệ thống tuần hoàn hô hấp. Các bệnh về hô hấp có thể dẫn đến giảm nồng độ oxi bão hòa trong máu b...,https://salt.tikicdn.com/cache/280x280/ts/product/25/32/0d/9dec64856bce74d8bb6a58804a797c5b.jpg,8,631569,KINGTECH,118708687
1544,Bàn Chải Đánh Răng Điện LocknLock Portable Electric Toothbrush ENR236 (162 x 20 x 20 mm),175000,"Đặc điểm nổi bậtBàn Chải Đánh Răng Điện LocknLock Portable Electric Toothbrush ENR236 (162 x 20 x 20 mm) với lông bàn chải sợi dupont mềm mại, chăm sóc tốt cho răng.22,000 xung động / phút, làm sạc...",https://salt.tikicdn.com/cache/280x280/ts/product/57/cc/14/d0965e20daf582aef6505b27fd87c913.jpg,8,48077,LocknLock,68826659
1545,"Derma Forte Gel 15g - Adavanced, Giảm Mụn Trứng Cá, Mờ Sẹo, Dưỡng Da",122000,"Cơ chế tác dụngGel mụn trứng cá Derma Forte Advanced đặc biệt hữu hiệu cho tất cả các loại mụn trứng cá, mụn đầu đen, mụn trắng,Mờ sẹo, ngừa vết thâm, ngừa tái phát mụn. Giúp làm sạch bã nhờn trên ...",https://salt.tikicdn.com/cache/280x280/ts/product/65/f5/77/078cd936ba0d3258287317fe6997d325.jpg,8,111736,Gamma,124480931
1546,"Kem chống nắng nâng tông Skin Aqua Tone up Lavender cho da tối màu & da vàng, dạng sữa Sunplay Skin Aqua Tone Up UV Milk Lavender SPF 50+ PA++++ 50g",160000,"Hiệu chỉnh màu da là một kỹ thuật trang điểm thú vị, được các nghệ sĩ trang điểm chuyên nghiệp sử dụng trong nhiều năm qua. Bằng việc áp dụng các màu sắc đối lập sẽ giúp trung hoà, hiệu chỉnh các nhượ...",https://salt.tikicdn.com/cache/280x280/ts/product/af/cb/4f/baf896d10cc545b28196476d9ab2b8aa.jpg,8,112882,Sunplay,13325863
1547,Combo 3 Phim Thấm Dầu Jomi Mayan (70 Tờ) - Xanh,163000,"Combo 3 Phim Thấm Dầu Jomi Mayan (70 Tờ) - Xanh có cấu tạo đặc biệt với đặc tính vi xốp, lấy dầu bằng cơ chế cơ học ở mức độ nano, siêu thấm hút dầu thừa trên da mặt, giúp loại đi nét bóng nhờn, làm t...",https://salt.tikicdn.com/cache/280x280/ts/product/95/3c/2b/253910b952f3d1fff6a70820c252a9af.png,8,31580,Mayan,426104
1548,Bao cao su Sagami 002 - Siêu mỏng - Non Latex - Hộp 6 chiếc,183000,"       Làm từ Polyurethane trong suốt, không mùi, sử dụng được cho người dị ứng cao su.   Độ bền cao hơn gấp 2 lần bao cao su thông thường, chịu lực kéo tốt hơn gấp 3 lần.   Nhiều chất bôi trơn ...",https://salt.tikicdn.com/cache/280x280/ts/product/e7/73/3e/1c541452bc9ec31251877a3d5b920179.jpg,8,22095,Sagami,108535251
1549,"Kem chống nắng nâng tông Skin Aqua Tone up Lavender cho da tối màu & da vàng, dạng tinh chất Sunplay Skin Aqua Tone Up UV Essence Lavender SPF 50+ PA++++ 50g",160000,"Hiệu chỉnh màu da là một kỹ thuật trang điểm thú vị, được các nghệ sĩ trang điểm chuyên nghiệp sử dụng trong nhiều năm qua. Bằng việc áp dụng các màu sắc đối lập sẽ giúp trung hoà, hiệu chỉnh các nhượ...",https://salt.tikicdn.com/cache/280x280/ts/product/af/14/90/37482e8819228ae34fb880aabb2ce893.jpg,8,112882,Sunplay,8959289
1550,Tẩy Da Chết Cà phê Đăk Lăk Cocoon 200ml,100000,"Cơ thể chúng ta hằng ngày vẫn đang đào thải hàng tỉ tế bào chết, chúng được lưu lại trên da, kết thành mảng cùng bụi bẩn, gây bít tắc lỗ chân lông, có thể khiến da nổi mụn. Vậy việc loại bỏ những lớp...",https://salt.tikicdn.com/cache/280x280/ts/product/27/83/c1/3003ba22c61baab8cfc8315459ed34fd.png,8,542605,The Cocoon,42889999
1551,"Combo Dầu gội, Dầu xả & Kem ủ TRESEMME Keratin Smooth Dưỡng tóc vào nếp suôn mượt vào nếp suôn mượt Công thức chuẩn salon Hydrolyzed Keratin 640g, 620g, 180ml",446000,"Trọn bộ bí quyết từ các nhà tạo mẫu tóc cho mái tóc suôn mượt chuẩn salon Tóc bạn không còn suôn mượt vào nếp sau cả ngày dài hay dù có thử mọi cách nhưng cũng không thể đẹp như ở salon? Bạn có biết,...",https://salt.tikicdn.com/cache/280x280/ts/product/b3/9f/52/d83fbbc3b7bca1e96277715ffb977bc0.png,8,27918,TRESemmé,95253531
1552,Bộ 2 Chai Nước súc miệng giúp nướu chắc khỏe Listerine Gum Care 750ml/chai 101109930,255000,"Better For The Planet! Tất cả sản phẩm LISTERINE nay đã được chuyển đổi hoàn toàn thành BAO BÌ TÁI CHẾ & AN TOÀN CHO DÒNG NƯỚC, sự cải tiến ra đời vì mục tiêu chung bảo vệ hành tinh, khuyến khích ...",https://salt.tikicdn.com/cache/280x280/ts/product/38/9e/e2/cfd18b42429b787744c9ced1d5e10075.jpg,8,41661,LISTERINE,90218797
1553,Bộ 2 đầu bàn chải điện P/S - Sạch Sâu,205000,"Đặc điểm nổi bậtĐầu bàn chải điện P/S S100 Pro Sạch Sâu sử dụng lông phủ Baking Soda giúp loại bỏ mảng bám vượt trội.Lông chải mềm mại, dịu nhẹ trên nướu.Lông chỉ thị màu xanh bạc màu sau khoảng 3...",https://salt.tikicdn.com/cache/280x280/ts/product/32/6d/f4/8e10f9e015457781946e5d59979cd50b.jpg,8,21271,P/S,133245970
1554,Cân điện tử thông minh Xiaomi Body Composition Scale 2 - Chính hãng,459000,Cân điện tử thông minh Xiaomi Body Composition Scale 2 trang bị không thể thiếu cho mỗi gia đình. Nếu bạn đang tìm kiếm một người bạn đồng hành hoàn hảo với chỉ số cân nặng và tỷ lệ cơ thể cho mỗi thà...,https://salt.tikicdn.com/cache/280x280/ts/product/f5/0f/04/27942f3369d15d1fccd38d281b6e6821.jpg,8,25422,Xiaomi,19640804
1555,Bao cao su Durex Kingtex 3 bao,40000,"Từ năm 1929 đến nay, Durex vẫn luôn sản xuất bao cao su từ những chất liệu tốt nhất, đảm bảo chất lượng cao. Trong hơn 90 năm qua, Durex không ngừng nghiên cứu và đa dạng hóa các dòng sản phẩm ngày c...",https://salt.tikicdn.com/cache/280x280/media/catalog/producttmp/f8/4d/7a/b38b447f6e7dcbef391b60a825a0c9cf.jpg,8,21261,Durex,1672155
1556,(Mẫu mới) Bộ Đôi Kem Dưỡng Da Ngày Và Đêm Trắng Hồng Rạng Rỡ Pond's White Beauty (45g),230000,"(Mẫu mới) Bộ Đôi Kem Dưỡng Da Ngày Và Đêm Trắng Hồng Rạng Rỡ Pond's White Beauty (45g) với công thức phức hợp dưỡng trắng Vitamin B3 giúp tăng cường khả năng dưỡng trắng từ sâu bên trong, làm mờ vết t...",https://salt.tikicdn.com/cache/280x280/ts/product/c8/af/67/989430ff64bdad49399f899e36352ab5.png,8,21273,Pond's,16625449
1557,Dầu Gội Dược Liệu Thái Dương 3 Hương Hoa Lá (500ml),115000,"Đặc điểm nổi bậtLàm sạch da đầu, giảm gàu và tế bào da chếtKháng khuẩn, ngăn ngừa gàu quay trở lạiCung cấp các dưỡng chất cần thiết cho da đầu và tóc, giúp da đầu khỏe mạnhGiảm tình trạng rụng tó...",https://salt.tikicdn.com/cache/280x280/ts/product/7e/f2/6e/5ea761af7ef20406b952e1a83aa4473b.jpg,8,185875,Sao Thái Dương,252035646
1558,"Máy Massage Cầm Tay Đa Năng KINGTECH  KT1768 - Mát Xa Chuyên Sâu Cho Cổ, Vai Gáy, Bụng, Lưng, Cánh Tay, Chân - Giảm Đau Mỏi Toàn Thân Cho Dân Văn Phòng, Gymer, Người Già, Người Lao Động Nặng - Món Quà Tuyệt Vời Cho Ông Bà, Bố Mẹ - Hàng Chính Hãng",575000,"Câu chuyện của KingTech: Chúng tôi cũng như các bạn - Đều đang phải chung sống với những vấn đề hằng ngày như: đi làm xa, làm việc trên máy tính nhiều giờ, trông trẻ sơ sinh, làm việc nhà ... tất cả...",https://salt.tikicdn.com/cache/280x280/ts/product/94/5d/db/7cd767000abe29184c7b98a9ed3e4979.jpg,8,631569,KINGTECH,48627056
1559,Bao Cao su Okamoto 0.01 PU Siêu mỏng Truyền Nhiệt Nhanh Hộp 2 Cái ,129000,BAO CAO SU OKAMOTO 0.01 PU SIÊU MỎNG TRUYỀN NHIỆT NHANH HỘP 2 CÁIDung tích: 02 cái/ hộpXuất xứ: NHẬT BẢNMÔ TẢDòng sản phẩm OK  0.01 Siêu siêu mỏng vô cùng mềm mại và an toàn.Không gây kích ứng d...,https://salt.tikicdn.com/cache/280x280/ts/product/1d/cf/58/fc1a3208de0d3cc1a20df347ff5a7b4c.png,8,64152,Okamoto,45559087
1560,Cân Sức Khỏe Điện Tử LocknLock ENC516BLK Dùng Trong Gia Đình - 180kg,631000,"LocknLock được thành lập từ năm 1985, trụ sở chính tại Seoul, Hàn Quốc được xem là nhà tiên phong đưa ra khái niệm mới trong lĩnh vực sản xuất hộp đựng thức ăn 4 khóa cạnh. Với nỗ lực nghiên cứu, sán...",https://salt.tikicdn.com/cache/280x280/ts/product/85/09/fa/0b8c7abf742e7b07400e106ed101f0c0.jpg,8,48077,LocknLock,68832828
1561,"Combo 3 Túi Khẩu Trang Y Tế ANYGUARD SENSE Lọc 99% Vi Khuẩn, Màu Sắc Trendy, An Toàn Da Nhạy Cảm Dành Cho Người Lớn (Túi 10 Chiếc/ Màu Xanh, Tím, Hồng)",71250,"KHẨU TRANG Y TẾ ANYGUARD SENSE PHIÊN BẢN MỚI 2022 ĐA SẮC MÀU - MANG ĐẾN PHONG CÁCH TƯƠI TRẺ, TRÀN ĐẦY NĂNG LƯỢNG, LÀ NGƯỜI BẠN ĐỒNG HÀNH CÙNG BẠN SUỐT NGÀY DÀI NĂNG ĐỘNG. SẢN PHẨM VỚI NHIỀU CẢI TIẾN Đ...",https://salt.tikicdn.com/cache/280x280/ts/product/9b/0b/a9/930bd066c0184e68d8e0d02b2b33a515.jpg,8,612965,Anyguard,183076377
1562,Sữa Rửa Mặt Dạng Gel Dành Cho Da Nhờn Mụn SVR Sebiaclear Gel Moussant 400ml,375000,"Sữa Rửa Mặt Dạng Gel Dành Cho Da Nhờn Mụn SVR Sebiaclear Gel Moussant 400ml là một sản phẩm làm sạch không chứa xà phòng giúp làm sạch, nhẹ nhàng làm thông thoáng làn da. Giúp làm sạch các chất bẩn và...",https://salt.tikicdn.com/cache/280x280/ts/product/e6/98/5e/fea7318f36b8fbde9b06b8cce705f767.png,8,52207,SVR,174834852
1563,"Khẩu trang KF94 - 4D An Tâm, không xù lông, dễ thở, ko đứt dây, nhiều màu ( 10 cái/túi)",7900,"CAM KẾT BÁN HÀNG:CUSTOMER IS KING:FREESHIP khi đạt giá trị đơn hàng tối thiểuĐược kiểm tra hàng trước khi thanh toánĐược đổi trả, hoàn hàng, trả hàng hoàn tiền nếu lỗi do nhà bánĐội ngũ nhân s...",https://salt.tikicdn.com/cache/280x280/ts/product/ae/bc/95/83df3e72b1acfa4262aeabafcbcae21f.png,8,477953,An Tâm,190252222
