id,name,price,description,image,category_id,brand_id,brand_name,tiki_product_id
536,Nồi Chiên Không Dầu Magic A-802 (4.6 Lít) Đỏ- Hàng Chính Hãng,1000000,"Thiết kế nhỏ gọn, sang trọngNồi Chiên Không Dầu Magic Korea A-802 với thiết kế hiện đại, gam màu đen sang trọng, kiểu dáng nhỏ gọn kết hợp các đường nét cong nhẹ nhàng và tinh tế, tạo nên 1 sản phẩm ...",https://salt.tikicdn.com/cache/280x280/ts/product/e0/69/82/f36f825f9e487fca25928294f88cd8c2.jpg,3,31702,Magic Korea,31502012
537,Quạt đứng Senko DTS1607 - Hàng chính hãng,450000,Quạt đứng ống sắt Senko DTS1607 có 7 cánh và 3 cấp tốc độ từ thấp đến cao cho người sử dụng có thể tùy chỉnh theo sở thích và mục đích sử dụng của mình. Được sản xuất tại Việt Nam dựa trên công nghệ N...,https://salt.tikicdn.com/cache/280x280/ts/product/95/be/b8/61d38f291f136b0f99352ba981605f28.png,3,114568,SENKO,4526261
538,Máy cắt tỉa lông mũi Panasonic ER-GN30-K453 - Hàng chính hãng,379000,"Thiết kế dành riêng cho lông mũi và taiThiết kế nhỏ gọn, thông minhTiện lợi có thể mang đi bất cứ đâuLưỡi dao được làm bằng thép không gỉCơ chế rung nhẹ tạo cảm giác dễ chịuLưỡi dao cạo uyển ...",https://salt.tikicdn.com/cache/280x280/ts/product/f2/74/16/78e9f4f67f674a333c0b7f7fa9adb46e.jpg,3,18804,Panasonic,170658293
539,Bộ 3 Lõi Lọc Số 1 RO KAROFI KRF-L1 - Hàng Chính Hãng,180000,"Bộ 3 lõi lọc số 1 có vai trò lọc sạch các chất bẩn, bùn đất, vi khuẩn, tạp chất có trong nướccó khả năng loại bỏ chất rắn, khí trong nước, ion kim loại nặng, vi khuẩn, siêu vi khuẩn cho nước trở nên t...",https://salt.tikicdn.com/cache/280x280/ts/product/b7/40/20/71cfe4d8d419baab53e83a93f649cda4.jpg,3,53819,Karofi,76016726
540,Bình Đun Siêu Tốc 2 Lớp Nagakawa NAG0315 (1.8 Lít) - Hàng Chính Hãng,389000,"Kiểu dáng đẹp, sang trọngBình Đun Siêu Tốc 2 Lớp Nagakawa NAG0315 (1.8 Lít) được thiết kế với kiểu dáng và màu sắc sang trọng nổi bật không gian bếp của gia đình bạn.Chất liệu cao cấp, siêu bềnTh...",https://salt.tikicdn.com/cache/280x280/ts/product/cf/aa/8b/3c97d9cb08d42c3fd04b520d60ee67d4.jpg,3,110935,Nagakawa,53758851
541,Bếp Hồng Ngoại Đôi Sanaky SNK - 202HGW - Hàng chính hãng,2880000,"Hoạt động mạnh mẽBếp Hồng Ngoại Đôi Sanaky AT - 202HGW hoạt động với công suất mạnh mẽ, truyền nhiệt nhanh, giúp nấu nhanh các món ăn trong thời gian ngắn, tiết kiệm điện năng và thời gian nấu nướng....",https://salt.tikicdn.com/cache/280x280/ts/product/6d/ac/f0/bb5d11e967d70481b52879cafa03e0f8.png,3,40633,Sanaky,445000
542,Bếp Gas Hồng Ngoại Đôi Sunhouse SHB004MT - Hàng chính hãng,629000,"Kiểu dáng sang trọngBếp gas dương Sunhouse SHB004MT là một trong những sản phẩm có thiết kế sang trọng, nổi bật với sự phối màu đen xanh ấn tượng, kiểu dáng hiện đại, thuận tiện cho người sử dụng....",https://salt.tikicdn.com/cache/280x280/ts/product/c5/47/55/a6336c6149635b659c6e9b6831a3e111.jpg,3,41048,Sunhouse,2394877
543,"Máy pha cà phê HiBREW H8A tự động đánh bọt sữa cho Cappuccino, Latte, áp suất 19 Bar, hàng chính hãng",4390000,QUÁ PHÙ HỢP CHO NHỮNG AI THÍCH UỐNG CAFE MÀ KHÔNG CẦN CHÚT KINH NGHIỆM NÀO!Một thế hệ mới trong thiết kế Máy pha cafe Espresso - Cappuccino - Latte.Sự lựa chọn thông minh cho những ai yêu thích những...,https://salt.tikicdn.com/cache/280x280/ts/product/0d/b9/22/a05bb1ba51894432d817a753b108f57b.jpg,3,556975,HiBREW,182139555
544,Máy đánh trứng tạo bọt cafe mini 2 trong 1 với 3 chế độ dùng pin sạc USB cao cấp,119000,"       Máy đánh bọt cafe - máy tạo bọt sữa - Máy đánh trứng cầm tay tiện lợi, máy đánh bọt mini   Đặc điểm:   1. Đa chức năng:máy đánh cafe máy đánh trứng, máy tạo bọt sữa, máy làm cocktail.   ...",https://salt.tikicdn.com/cache/280x280/ts/product/22/f0/40/318e7b6c91c7de1b5a22d0d789624172.png,3,111461,OEM,88249851
545,Máy Hút Bụi Cầm Tay Không Dây Sử Dụng Pin Sạc DAMAS Vacuum Cleaner D610W - Hàng Chính Hãng,559000," ĐẶC ĐIỂM NỔI BẬT:Máy Hút Bụi Cầm Tay Không Dây Sạc Pin DAMAS D610W là một trong những sản phẩm hữu ích trong gia đình bạn. Với công suất lớn 120W và lực hút mạnh mẽ lên đến 16000Pa, sản phẩm này có ...",https://salt.tikicdn.com/cache/280x280/ts/product/69/db/6a/94bb5c9f483e28f81fcebd444a8c1ba0.png,3,4234729,Damas,161017652
546,Bình thủy điện Panasonic NC-EG4000CSY 4 lít - Hàng Chính Hãng,2289000,"Dung tích lớn đáp ứng đủ nhu cầu nước nóng cho cả gia đình như pha trà, cà phê, nấu mìRuột bình phủ carbon chống dính, an toàn cho sức khỏe, dễ dàng vệ sinh sau khi dùng Thang đo mực nước giúp bạ...",https://salt.tikicdn.com/cache/280x280/ts/product/05/07/ec/6df2a83e29be4356f433f91ee29e3e25.jpeg,3,18804,Panasonic,137727744
547,MÁY THỔI VÀ HÚT BỤI PHÒNG NÉT SD9020- HÀNG NHẬP KHẨU,221570,"Giới thiệu sản phẩm Máy thổi - hút bụi phòng Net cầm tay SD9020 (Đỏ)Khuôn viên trong nhà hay phòng game của bạn đang bị bám bởi bụi bẩn , xin giới thiệu đến các bạn Máy thổi bụi SD9020- có thể làm sạc...",https://salt.tikicdn.com/cache/280x280/ts/product/cf/c8/96/e1b4d7d5cca0a1de693db18b50215a53.jpg,3,111461,OEM,46476944
548,Ấm sắc thuốc Trường An TA68 Nâu - Hàng chính hãng,545000,                                                                                       Mặt trước của sản phẩm Ấm sắc thuốc Trường An TA 68 được thiết kế với biểu tượng hoa sen cách điệu...,https://salt.tikicdn.com/cache/280x280/ts/product/d8/53/7e/ddf9f3e308ab7d1619c0fb7871366a8f.jpg,3,280915,Trường An,63560677
549,Nồi Cơm Điện Nắp Rời Happy Cook HCD-180V 1.8L - Hàng Chính Hãng,459000,"Được thiết kế với kiểu dáng tinh tế, màu sắc nhã nhặn phù hợp với mọi không gian bếp. Nồi cơm với lòng nồi là hợp kim nhôm cao cấp, không phản ứng hóa học giúp bạn yên tâm hơn khi sử dụng. Mâm nhiệt l...",https://salt.tikicdn.com/cache/280x280/ts/product/53/91/ac/3fbd8b2d799c1ddc4eb24de3d4447d53.jpg,3,21125,Happy Cook,141673652
550,Lò Nướng Điện Sunhouse SHD4206 (10L) - Hàng chính hãng,544000,"Những năm gần đây, Lò nướng trở thành một thiết bị nhà bếp được yêu thích của các bà nội trợ nhờ khả năng chế biến các món nướng thơm ngon, hấp dẫn mà lại tiện lợi ngay tại nhà. Lựa chọn lò nướng cho...",https://salt.tikicdn.com/cache/280x280/ts/product/01/d7/fc/6d00ff9f2da72fda312424b4de80b33e.jpg,3,41048,Sunhouse,6772415
551,Quạt điện Senko để bàn tiện lợi cao cấp B1216 màu ngẫu nhiên - Hàng Chính Hãng,285000,"+   Lồng quạt có khe hở nang quạt nhỏ, ngón tay người không thể chạm vào cánh quạt.+   Người sử dụng không chạm được vào bộ phận mang điện bên trong quạt+   Có cầu chì bảo vệ chống cháy khi cách ...",https://salt.tikicdn.com/cache/280x280/ts/product/9c/02/17/23102b671fe476b22096858e57d15db0.png,3,114568,SENKO,78625780
552,Nồi Cơm Điện Nắp Gài Sharp KS-181TJV - 1.8 L - Hàng chính hãng,549000,"Thiết kế sang trọng, hiện đạiNồi Cơm Điện Nắp Gài Sharp KS-181TJV - 1.8 L  có thiết kế đơn giản với tông màu trắng, hoa văn trang trí tinh xảo trông như những viên kim cương đang tỏa sáng. Sản phẩm k...",https://salt.tikicdn.com/cache/280x280/ts/product/3f/a4/fb/43fd770caf5def3c2fefffbc0e28963f.jpg,3,19912,Sharp,456050
553,Nồi Lẩu Điện Sunhouse SHD4526 (4.0 Lít) - Hàng Chính Hãng,1100000,"Thiết kế trang nhã, gọn nhẹNồi lẩu điện SUNHOUSE SHD4526 có thân nồi làm từ thép sơn tĩnh điện có khả năng chịu nhiệt cao và ít bị ảnh hưởng bởi môi trường. Màu đồng sang trọng tinh tế, không bám bẩn...",https://salt.tikicdn.com/cache/280x280/ts/product/e5/2a/3e/37ee51e7af5bcaa5a0b9c5a076ae8677.jpg,3,41048,Sunhouse,20373507
554,Máy lọc không khí Sharp FP-J40E-W - Hàng chính hãng,4100000,"Máy lọc không khí Sharp thiết kế tinh tế, sang trọngMáy lọc không khí Sharp FP-J40E-W được thiết kế nhỏ gọn với màu trắng sang trọng giúp tô điểm không gian nội thất của gia đình. Chiếc máy lọc hứa ...",https://salt.tikicdn.com/cache/280x280/ts/product/43/b9/e3/aa8fd6c78160cd457ff326a5ff558858.jpg,3,19912,Sharp,126734433
555,Nồi Điện Đa Năng Lock&Lock EJC141 (1.5 Lít) - Hàng Chính Hãng,1065000,"Thiết kế hiện đại, nhỏ gọnNồi Điện Đa Năng Lock&Lock EJC141 có thiết kế kiểu dáng hiện đại, nhỏ gọn, thuận tiện hco bạn đặt ở bất cứ đâu trong gian bếp mà không chiếm quá nhiều diện tích.Chất l...",https://salt.tikicdn.com/cache/280x280/ts/product/d9/fe/5c/c1a48e288ed30008d091e07b186cba43.jpg,3,48077,LocknLock,27577963
556,Lò Nướng Chân Không Điện Tử Lock&Lock EJF291BLK 10L - Hàng Chính Hãng,2599000,"Kiểu dáng sang trọng, nhỏ gọnLò Nướng Chân Không Điện Tử Lock&Lock EJF291BLK sở hữu thiết kế nhỏ gọn nhưng vẫn sang trọng, màu đen hiện đại, phù hợp với bất kỳ không gian căn bếp nào....",https://salt.tikicdn.com/cache/280x280/ts/product/68/7d/aa/3378339df6c04916a0aa599c7813b688.jpg,3,48077,LocknLock,87960372
557,Máy Xay Sinh Tố Mini Hafele GS-621 (350W) - Hàng Chính Hãng,579000,"Thiết kế hình trụ tinh tếMáy Xay Sinh Tố Mini Hafele GS-621 sở hữu thiết kế thân hình trụ tinh tế, kiểu dáng nhỏ gọn tiện dụng, phù hợp đem theo khi đi du lịch cũng như dễ dàng di chuyển đến nhiều vị...",https://salt.tikicdn.com/cache/280x280/ts/product/1d/79/47/a38640d19369ca6cd924ac800f5f8f23.jpg,3,205197,HAFELE,15398266
558,Máy Xay Đồ Ăn Dặm Cho Bé 6 Lưỡi Cối Thuỷ Tinh Hàng Nội Địa Trung Bản Cao Cấp Siêu Mịn Tiện Dụng - Tặng Kèm Dụng Cụ Rửa Máy-Hàng Chính Hãng ,236550,Máy Xay Đồ Ăn Dặm Cho Bé 6 Lưỡi Cối Thuỷ Tinh Hàng Nội Địa Trung Bản Cao Cấp Siêu Mịn Tiện Dụng - Tặng Kèm Dụng Cụ Rửa Máy - Hàng Chính HãngNhiều mẹ băn khoăn khi chỉ muốn nấu cho bé 1 chén cháo thô...,https://salt.tikicdn.com/cache/280x280/ts/product/3f/80/28/edf894314523784ec2794247829010de.jpg,3,5132069,MINIIN,185248203
559,Nồi cơm điện Kim Cương 0.6L - KC-0.6L - Hàng chính hãng,259000,"● Nồi cơm nắp rời 0.6 lít Kim Cương với kiểu dáng xinh xắn cùng bảng điều khiển với nút gạt nhỏ nhắn và 2 đèn báo chế độ dễ thương mang lại một thiết kế trẻ trung, đáng yêu giúp ngôi nhà bạn trở nên s...",https://salt.tikicdn.com/cache/280x280/ts/product/b7/66/e0/b980be420279638df4babbf45fabf4cd.jpg,3,148535,Kim Cương,73230349
560,Nồi áp suất điện tử Lock&Lock EJP666SLV 6 Lít - Hàng chính hãng,1919000,"Thiết kế tiện lợiNồi áp suất điện tử Lock&Lock EJP666SLV cho phép bạn chọn 1 trong 11 chức năng đặt sẵn, thật tuyệt vời cho người mới bắt đầu.Đa chức năngNồi được trang bị 11 chức năng tro...",https://salt.tikicdn.com/cache/280x280/ts/product/8d/16/3e/9242556bf1de5fcdf30aec762ca9f51b.jpg,3,48077,LocknLock,134333386
561,Máy xay thịt osaka japan new 2019 - Hàng Chính Hãng,149900,"Thiết kế nhỏ gọn, tinh tếMáy xay thịt Osaka sở hữu thiết kế tinh gọn, từng chi tiết được gia công tỉ mỉ, bề mặt nhẵn bóng, mang đến vẻ đẹp sang trọng, hiện đại mà vẫn tiết kiệm không gian cho căn bếp...",https://salt.tikicdn.com/cache/280x280/ts/product/c7/fe/40/78fb6f0bb6360cb4709618c2b95a6027.jpg,3,143278,OSAKA,11502504
562,"Quạt Mini Tích Sạc Điện Gấp Gọn Đa Năng Để Bàn Làm Việc,  3 Chế Độ Gió Linh Hoạt - Quạt Gấp Gọn Điều Chỉnh Chiều Cao Q17 Giải pháp cho mùa hè Siêu tiện Ích",112900,"Quạt Tích Điện Gấp Gọn Q17, Quạt Mini Để Bàn - 3 Tốc Độ Gió Siêu Mát, Tùy Chỉnh Độ Cao, Nhỏ Gọn, Không Tiếng ỒnGIỚI THIỆU SẢN PHẨM QUẠT TÍCH ĐIỆN GẤP GỌN Q17 - Quạt để bàn gấp gọn hình trụ siêu hot...",https://salt.tikicdn.com/cache/280x280/ts/product/6c/e9/4c/88d43f13cacb7b30f12d5dafa49ff0fe.jpg,3,111461,OEM,187284937
563,Bếp Gas Dương Đôi Kangaroo KG8G1A - Hàng Chính Hãng,690000,"Kiểu dáng hiện đại, dễ dùng cho mọi gian bếpBếp Gas Dương Đôi Kangaroo KG8G1A với thiết kế bếp gas đôi với 2 vùng nấu tiện dụng để nấu nhiều món cùng lúc.Chất liệu cao cấpSở hữu chất liệu kính cườ...",https://salt.tikicdn.com/cache/280x280/ts/product/3a/df/06/c52eab9c31c0f9df744f7c7b01e5293a.jpg,3,19589,Kangaroo,132847951
564,"Nồi Chưng Yến, Nồi Tiềm Thuốc Bắc, Nồi Nấu Chậm BEAR SUBE001 Kèm Lồng Hấp Dung Tích 0.8 Lít, Công Suất 200 W - Hàng Chính Hãng",509000,"Nồi nấu chậm 0.8L Bear DDZ-B08C1 (SUBE001) phiên bản quốc tế với 6 tính năng nấu thông minh, tích hợp bảng điều khiển tiếng anh, hướng dẫn tiếng việt và chân cắm 2 chấu phù hợp với ổ cắm tại Việt Nam....",https://salt.tikicdn.com/cache/280x280/ts/product/b4/4e/af/e70110d2df3083b00b7032b1d76ae3be.png,3,198523,Bear,253190854
565,Máy xay sinh tố cầm tay Philips HR2531/00 (650W) - Hàng chính hãng,571000,"Thiết kế tiện dụngMáy xay sinh tố cầm tay Philips HR2531/00 có kết cấu vững chắc, màu trắng sáng sạch đẹp, cầm nắm thuận tay, dễ xay Đáp ứng nhu cầu xay sinh tố, xay thịt, xay hạt trong gia đình có c...",https://salt.tikicdn.com/cache/280x280/ts/product/56/2b/95/2c1f1f4135496f402a8266d7de08aba7.jpg,3,19018,Philips,67012257
566,Máy cạo râu khô và ướt Philips S1103/02 - Hàng Chính Hãng,629000,"Máy cạo râu Philips S1103/02 hiện đại với nhiều tính năng giúp bạn nhanh chóng có được vẻ điển trai, cuốn hútThiết kế nhỏ gọn Máy cạo râu màu đen dạng cầm tay, kiểu dáng nhỏ gọn, tính tiện lợi cao v...",https://salt.tikicdn.com/cache/280x280/ts/product/cb/59/16/363a0c938262b4d420e5dd29f3b23ec6.jpg,3,19018,Philips,162841495
567,"Máy sấy tóc, máy sấy tóc công suất 2000W, tặng kèm 5 phụ kiện sấy tóc tạo kiểu chuyên dụng - Funu Home",95000,"Máy sấy tóc công suất 2000W tặng kèm 5 phụ kiện, sấy tạo kiểu tóc chuyên nghiệp.Lưu ý: - Nút đỏ là nút nguồn + mức độ nóng của thanh đốt (nhiệt). Nút đỏ có 2 nấc tăng độ nóng cho máy. Nút xanh tăng ...",https://salt.tikicdn.com/cache/280x280/ts/product/99/9c/02/6514a715331ea14895c7f96f3fd8c1aa.jpeg,3,111461,OEM,212981956
568,Nồi Chiên Không Dầu Lock&Lock EJF357WHT (5.2 Lít) - Hàng Chính Hãng,2100000,"Nồi Chiên Không Dầu Lock&Lock EJF357WHT (5.2 Lít) chỉ cần nguyên liệu, không cần dầu mỡ, có thể giảm chất béo, giúp người dùng có thể chế biến những món ăn có lợi cho sức khỏe.Thức ăn không dầu...",https://salt.tikicdn.com/cache/280x280/ts/product/32/2c/39/0cc9606d4c39fae88dbb8523b0242833.jpg,3,48077,LocknLock,36627593
569,"Tông Đơ Cắt Tóc Chuyên Nghiệp Kemei 809A, Tích Hợp Pin 2600 mAh Sử Dụng 240 phút Công Suất 5W, Đèn Led Hiện Dung Lượng Pin, Lưỡi Cắt Titatium, Động Cơ Hạn Chế Tiếng Ồn - HÀNG CHÍNH HÃNG",220000,"Tông Đơ Cắt Tóc Chuyên Nghiệp Kemei 809AHiện nay, việc mua tông đơ về cắt tóc cho cả nhà là chuyện thường gặp tại các gia đình tại Việt Nam. Bố cắt cho con, các mẹ cắt cho các bé khi các bé sợ ra tiệ...",https://salt.tikicdn.com/cache/280x280/ts/product/73/b8/39/197c69b7d5c3a8b61d7859ef4dcf03bc.jpg,3,63894,Kemei,169561154
570,Bếp Gas Dương Mặt Kính Sunhouse SHB204MT - Hàng chính hãng,550000,"Mặt kính sang trọng và hiện đại, tiết kiệm ga tối đaBếp gas Sunhouse SHB204MT với thiết kế hiện đại và tinh tế, góp phần tạo cho không gian bếp nhà bạn thêm lý tưởng và tạo cảm giác hứng thú khi nấu...",https://salt.tikicdn.com/cache/280x280/ts/product/72/eb/78/2a69c6ef654a443673144a616ad6e7b0.jpg,3,41048,Sunhouse,7270329
571,Quạt Treo Tường Toshiba F-WSA20(H)VN (55W) - Xám - Hàng chính hãng,1050000,"Thiết kế nhỏ gọnQuạt Treo Tường Toshiba F-WSA20(H)VN sở hữu thiết kế hiện đại kết hợp màu sắc tinh tế phù hợp với nhiều không gian nội thất. Đặc biệt, quạt có kiểu dáng nhỏ gọn giúp bạn tiết kiệm diệ...",https://salt.tikicdn.com/cache/280x280/ts/product/b3/15/c6/9fd704d92ea0fff208e1b912f6405842.jpg,3,18634,Toshiba,2635459
572,"Lõi lọc không khí xiaomi air purifier 2S, 2H, 3, 3H và pro (Xanh) - Hàng Nhập Khẩu",649000,"Lõi lọc không khí xiaomi air purifier 2S, 2H, 3, 3H và pro (Xanh)Thông Tin Chi TiếtXuất xứ thương hiệuTrung QuốcXuất xứTrung QuốcModelHepaThương hiệuXiaomiSản phẩm có được bảo hà...",https://salt.tikicdn.com/cache/280x280/ts/product/99/97/5c/b80ecdc5e516db78b689e5bc96bb08b1.jpg,3,25422,Xiaomi,59262620
573,Quạt Điện Đứng 7 cánh Senko LTS1636 - Giao Màu Ngẫu Nhiên - Hàng Chính Hãng,415000,"Quạt điện đứng 7 cánh Senko LTS1636 nhỏ gọn để bàn rất tiện lợi, tiết kiệm không gian cùng nhiều tính năng thông minh … sẽ giúp cuộc sống của bạn trở nên thật thoải mái và dễ chịu. Với thiết kế để đứn...",https://salt.tikicdn.com/cache/280x280/ts/product/84/6c/df/f6f823d274a2a4783b289cf6854bba5a.png,3,114568,SENKO,2498045
574,Máy cạo râu Philips điện 3 lưỡi tự mài đa năng khô và ướt S1050 - Hàng Nhập Khẩu,649000,Thông số kỹ thuật- Công nghệ Aquatec cạo khô và ướt.- Đầu cạo linh hoạt xoay 3 hướng cạo nhanh và sát.- Tay cầm tiện dụng để điều khiển tốt và chính xác hơn.- Sử dụng 45 phút sau mỗi lần sạc ...,https://salt.tikicdn.com/cache/280x280/ts/product/f6/3a/0e/688b630c273f289dca38c9f4ed210b4c.jpg,3,243687, Philips,165045880
575,Tông đơ cắt tóc chuyên nghiệp thế hệ mẫu mã kiểu dáng mớiKemei KM1998,381000,Giới thiệu TÔNG ĐƠ CẮT TÓC KEMEI KM – 1998 MÁY NHẸ SIÊU MẠNHTông đơ không dây KEMEI KM-1998 là sản phẩm tông đơ cao cấp nhất của thương hiệu Kemei hiện nay.Đây là Tông Đơ Pin với kiểu dáng sang trọng...,https://salt.tikicdn.com/cache/280x280/ts/product/3c/ae/87/5fe172261402c023ab8fab209d1157f1.jpg,3,63894,Kemei,48972911
576,Bàn Ủi Hơi Nước Philips STH3010/70 (1000W) - Hàng Chính Hãng,1035000,"Bàn Ủi Hơi Nước Philips STH3010/70 - Hàng Chính Hãng tiện lợi, dễ sử dụngChắc chắn, nhẹ và tay cầm gấp gọn đượcNgăn chứa nước tháo rời – Dung tích 100ml có thể ủi được 3 món đồỦi nếp nhăn nhanh ...",https://salt.tikicdn.com/cache/280x280/ts/product/31/4d/40/e8b521bb3a92d5a90607bd7139b250f4.jpg,3,19018,Philips,81676555
577,Máy cạo râu du lịch cầm tay Philips S1301/02 - Chính hãng,829000,"THÔNG TIN CHI TIẾT VỀ MÁY CẠO RÂU PHILIPS S1301/02:Máy cạo râu Series 1000 mới của Philips được thiết kế để cạo râu dễ dàng, êm ái và bảo vệ da tốt hơn. Lưỡi cạo tự mài bén chất lượng cao và đầu cạo ...",https://salt.tikicdn.com/cache/280x280/ts/product/55/37/e8/912cb6343828ec7e777292472b96f1ae.jpg,3,19018,Philips,178462954
578,Tông đơ cắt tóc chuyên nghiệp kemei 809A,229000,"Tông Đơ Cắt Tóc Chuyên Nghiệp Kemei 809AHiện nay, việc mua tông đơ về cắt tóc cho cả nhà là chuyện thường gặp tại các gia đình tại Việt Nam. Bố cắt cho con, các mẹ cắt cho các bé khi các bé sợ ra tiệ...",https://salt.tikicdn.com/cache/280x280/ts/product/73/b8/39/9cd7df8c16813a6f05ff05e250b943f8.jpg,3,63894,Kemei,51998725
579,Máy cạo râu du lịch Philips PQ206,339000,THÔNG TIN CHI TIẾT MÁY CẠO RÂU DU LỊCH PQ206:Máy cạo râu có thể sạc lại PQ206 của Philips kết hợp hệ thống cạo cắt sát với các đầu xoay độc lập. Bạn có thể tự tin rằng bạn sẽ luôn trông tuyệt vời mỗ...,https://salt.tikicdn.com/cache/280x280/ts/product/75/88/42/8da7a17729324e84f668f966e337ec13.jpg,3,19018,Philips,178462936
580,Nồi Chiên Không Dầu Sunhouse SHD4027 (6 Lít) - Hàng chính hãng,1099000,"Thiết kế hiện đại, sang trọng với chất liệu an toànNồi chiên không dầu SUNHOUSE SHD4027 6 lít có kiểu dáng hiện đại với tone màu đen bạc sang trọng, tối giản, phù hợp với nhiều không gian nội thất kh...",https://salt.tikicdn.com/cache/280x280/ts/product/d9/e1/0b/3801266082c4699dc6d8fc620fb39a51.jpg,3,41048,Sunhouse,162177652
581,Cây Nước Nóng Lạnh Sunhouse SHD9601 - Hàng chính hãng,940000,"Thiết kế hiện đại, trang nhãCây nước nóng lạnh Sunhouse SHD9601 kiểu dáng nhỏ gọn, kích thước 31.2x30x39.7 cm và cân nặng chỉ 2.5kg, cây nước Sunhouse SHD9601 rất tiết kiệm diện tích nên bạn có thể t...",https://salt.tikicdn.com/cache/280x280/ts/product/b1/e6/be/69ad14f8bd31b104d7a0c79e353829a6.jpg,3,41048,Sunhouse,2241935
582,Tông Đơ Cắt Tóc Kemei KM 5017 - Tặng Kèm Bộ Kéo Cắt Và Tỉa Tóc Không Gỉ Và Lược,350000,"Tông Đơ Cắt Tóc KM 5017 - Tặng Kèm Bộ Kéo Cắt Và Tỉa Tóc Không Gỉ Và Lược - Tông đơ cắt tóc Kemei 5017 Thiết kế nhỏ gọn ,tiện dụng.- Lưỡi cắt mỏng ,mau giúp cắt sạch ,trắng kể cả tóc mỏng ,thưa.- ...",https://salt.tikicdn.com/cache/280x280/ts/product/38/a0/5d/4a68b3a580d3b7105e48568d99b3d12e.jpg,3,63894,Kemei,68942787
583,Máy Cạo Râu KM-6650 Đa Năng 4 Trong 1 Tích Hợp Pin 1400 mAh Công Suất 3W Kiêm Tông Đơ Cắt Tóc & Máy Tỉa Lông Mũi -HÀNG CHÍNH HÃNG,161000,CAM KẾT CỦA SHOP:HÀNG CHUẨN NHƯ HÌNHHOÀN 100% GIÁ TRỊ ĐƠN HÀNG NẾU KHÔNG GIỐNG MÔ TẢHỖ TRỢ MIỄN PHÍ ĐỔI - TRẢ SẢN PHẨM MỌI TRƯỜNG HỢP.THÔNG TIN SẢN PHẨM MÁY CẠO RÂU KEMEI 6650- Chất liệu : + Lư...,https://salt.tikicdn.com/cache/280x280/ts/product/05/d5/8f/98eee834cfad8f3974c369aaa42098da.jpg,3,63894,Kemei,174085836
584,"Quạt mini tích điện đeo cổ thời trang, giải nhiệt mùa hè đi du lịch , văn phòng DQ203 pin 2000mAH ",179000,"Thiết mang phong cách thời trang cổ điển, đa mầu sắc ( Trắng, hồng, xanh )Pin 2000mAh , quạt hoạt động 10h mà không cần sạcMàn hình LED hiển thị dung lượng Pin hiện đại Cánh quạt 29 lá chế độ gió mạn...",https://salt.tikicdn.com/cache/280x280/ts/product/f4/d6/90/5a3c0ec2edd11a41590a0dec30ad9148.jpg,3,111461,OEM,90524877
585,Máy Xay Sinh Tố Lock&Lock EJM462 (350W - 1.2 Lít) - Hàng Chính Hãng,896000,"Thiết kế hiện đại, nhỏ gọnMáy Xay Sinh Tố Lock&Lock EJM462 sở hữu thiết kế hiện đại, nhỏ gọn, với đường kính máy chỉ ngang bằng một chiếc bình hoặc một chiếc cốc nước uống hàng ngày, do đó máy rấ...",https://salt.tikicdn.com/cache/280x280/ts/product/61/42/9f/19d3c5f6a89536c44ae7397f45b9a6d1.jpg,3,48077,LocknLock,27577966
586,"Nồi Lẩu Điện Đa Năng Mini Ca Nấu Mì, Cơm Đa Năng 2 Tầng Cao Cấp Núm Xoay 2 Nấc Nhiệt Kèm Giá Hấp 1,8L Chính Hãng MINIIN",169000,"Nồi Lẩu Điện Mini Núm Xoay 2 Nấc Nhiệt Kèm Giá Hấp 1,8L, Ca Nấu Mì,Nấu Cơm Đa Năng 2 Tầng Cao Cấp- Chính Hãng MINIIN  Ưu điểm nổi bật của Nồi Điện Đa Năng 1.8 Lít - Nồi Điện Mini 2 Tầng Tặng Kèm Kh...",https://salt.tikicdn.com/cache/280x280/ts/product/57/8a/e1/c45b375ff74a70298d9c2041394721ed.png,3,5132069,MINIIN,133815741
587,Máy ép chậm Panasonic MJ L500 - Hàng nhập khẩu,4690000,"Thiết kế nhỏ gọn tinh tếMáy Ép Chậm Panasonic PAVH-MJ-L500SRA có thiết kế nhỏ gọn tinh tế không chiếm nhiều không gian bếp nhà bạn. Ống tiếp trái cây dài có thể cho được nhiều hoa quả vào ép, tiết ki...",https://salt.tikicdn.com/cache/280x280/ts/product/28/10/8c/5fdcb838f9d1cf313f396cab9aab326f.jpg,3,18804,Panasonic,26031273
588,"Máy Hút Bụi Cầm Tay Không Dây VinBuy Lực Hút Mạnh Mẽ 16000PA Chức Năng Hút Bụi Khô Và Ướt - Máy Hút Bụi Ô Tô, Máy Hút Bụi Gia Đình - Hàng Chính Hãng",351000,"Máy Hút Bụi Cầm Tay Không Dây VinBuy Lực hút mạnh mẽ - Máy Hút Bụi Ô Tô, Máy Hút Bụi Gia Đình - Hàng Chính Hãng ...",https://salt.tikicdn.com/cache/280x280/ts/product/3d/fa/c5/9757bf69cecceb9b2d90b96d9c8292fd.png,3,4224691,VinBuy,184973099
